Top Shotter, Misc: DMX, dmx/topshotter, http://www.azlyrics.com/lyrics/dmx/topshotter.html
Trippin Remix, Misc: DMX, dmx/trippinremix, http://www.azlyrics.com/lyrics/dmx/trippinremix.html
Whatcha Gonna Do, Misc: DMX, dmx/whatchagonnado, http://www.azlyrics.com/lyrics/dmx/whatchagonnado.html
I Need A Doctor, Misc: Dr. Dre, drdre/ineedadoctor, http://www.azlyrics.com/lyrics/drdre/ineedadoctor.html
Intro, Room For Improvement, drake/intro, http://www.azlyrics.com/lyrics/drake/intro.html
Money (Remix), Room For Improvement, drake/moneyremix, http://www.azlyrics.com/lyrics/drake/moneyremix.html
City Is Mine, Room For Improvement, drake/cityismine, http://www.azlyrics.com/lyrics/drake/cityismine.html
Come Winter, Room For Improvement, drake/comewinter, http://www.azlyrics.com/lyrics/drake/comewinter.html
S.T.R.E.S.S., Room For Improvement, drake/stress, http://www.azlyrics.com/lyrics/drake/stress.html
Try Harder, Room For Improvement, drake/tryharder, http://www.azlyrics.com/lyrics/drake/tryharder.html
Kick. Push (Remix), Room For Improvement, drake/kickpushremix, http://www.azlyrics.com/lyrics/drake/kickpushremix.html
City Is Mine, Comeback Season, drake/cityismine, http://www.azlyrics.com/lyrics/drake/cityismine.html
Going In For Life, Comeback Season, drake/goinginforlife, http://www.azlyrics.com/lyrics/drake/goinginforlife.html
Don't You Have A Man, Comeback Season, drake/dontyouhaveaman, http://www.azlyrics.com/lyrics/drake/dontyouhaveaman.html
Bitch Is Crazy, Comeback Season, drake/bitchiscrazy, http://www.azlyrics.com/lyrics/drake/bitchiscrazy.html
Do What U Do (Remix), Comeback Season, drake/dowhatudoremix, http://www.azlyrics.com/lyrics/drake/dowhatudoremix.html
Lust For Life, So Far Gone, drake/lustforlife, http://www.azlyrics.com/lyrics/drake/lustforlife.html
Let's Call It Off, So Far Gone, drake/letscallitoff, http://www.azlyrics.com/lyrics/drake/letscallitoff.html
A Night Off, So Far Gone, drake/anightoff, http://www.azlyrics.com/lyrics/drake/anightoff.html
The Calm, So Far Gone, drake/thecalm, http://www.azlyrics.com/lyrics/drake/thecalm.html
Brand New, So Far Gone, drake/brandnew, http://www.azlyrics.com/lyrics/drake/brandnew.html
The Calm, So Far Gone, drake/thecalm92599, http://www.azlyrics.com/lyrics/drake/thecalm92599.html
Fear, So Far Gone, drake/fear, http://www.azlyrics.com/lyrics/drake/fear.html
Fireworks, Thank Me Later, drake/fireworks, http://www.azlyrics.com/lyrics/drake/fireworks.html
The Resistance, Thank Me Later, drake/theresistance, http://www.azlyrics.com/lyrics/drake/theresistance.html
Show Me A Good Time, Thank Me Later, drake/showmeagoodtime, http://www.azlyrics.com/lyrics/drake/showmeagoodtime.html
Up All Night, Thank Me Later, drake/upallnight, http://www.azlyrics.com/lyrics/drake/upallnight.html
Thank Me Now, Thank Me Later, drake/thankmenow, http://www.azlyrics.com/lyrics/drake/thankmenow.html
I'm Ready For You, Young Sweet Jones, drake/imreadyforyou, http://www.azlyrics.com/lyrics/drake/imreadyforyou.html
The Resistance (Remix), Young Sweet Jones, drake/theresistanceremix, http://www.azlyrics.com/lyrics/drake/theresistanceremix.html
To The Floor, Young Sweet Jones, drake/tothefloor, http://www.azlyrics.com/lyrics/drake/tothefloor.html
Over My Dead Body, Take Care, drake/overmydeadbody, http://www.azlyrics.com/lyrics/drake/overmydeadbody.html
Crew Love, Take Care, drake/crewlove, http://www.azlyrics.com/lyrics/drake/crewlove.html
Lord Knows, Take Care, drake/lordknows, http://www.azlyrics.com/lyrics/drake/lordknows.html
Cameras, Take Care, drake/cameras, http://www.azlyrics.com/lyrics/drake/cameras.html
The Real Her, Take Care, drake/therealher, http://www.azlyrics.com/lyrics/drake/therealher.html
Look What You've Done, Take Care, drake/lookwhatyouvedone, http://www.azlyrics.com/lyrics/drake/lookwhatyouvedone.html
The Ride, Take Care, drake/theride, http://www.azlyrics.com/lyrics/drake/theride.html
Hate Sleeping Alone, Take Care, drake/hatesleepingalone, http://www.azlyrics.com/lyrics/drake/hatesleepingalone.html
The Motto, Take Care, drake/themotto, http://www.azlyrics.com/lyrics/drake/themotto.html
Wu-Tang Forever, Nothing Was The Same, drake/wutangforever, http://www.azlyrics.com/lyrics/drake/wutangforever.html
Own It, Nothing Was The Same, drake/ownit, http://www.azlyrics.com/lyrics/drake/ownit.html
Hold On We're Going Home, Nothing Was The Same, drake/holdonweregoinghome, http://www.azlyrics.com/lyrics/drake/holdonweregoinghome.html
The Motion, Nothing Was The Same, drake/themotion, http://www.azlyrics.com/lyrics/drake/themotion.html
Legend, If You're Reading This It's Too Late, drake/legend, http://www.azlyrics.com/lyrics/drake/legend.html
Know Yourself, If You're Reading This It's Too Late, drake/knowyourself, http://www.azlyrics.com/lyrics/drake/knowyourself.html
Preach, If You're Reading This It's Too Late, drake/preach, http://www.azlyrics.com/lyrics/drake/preach.html
Wednesday Night Interlude, If You're Reading This It's Too Late, drake/wednesdaynightinterlude, http://www.azlyrics.com/lyrics/drake/wednesdaynightinterlude.html
Used To, If You're Reading This It's Too Late, drake/usedto, http://www.azlyrics.com/lyrics/drake/usedto.html
You & The 6, If You're Reading This It's Too Late, drake/youthe6, http://www.azlyrics.com/lyrics/drake/youthe6.html
6PM In New York, If You're Reading This It's Too Late, drake/6pminnewyork, http://www.azlyrics.com/lyrics/drake/6pminnewyork.html
My Side, If You're Reading This It's Too Late, drake/myside, http://www.azlyrics.com/lyrics/drake/myside.html
30 For 30 Freestyle, What A Time To Be Alive, drake/30for30freestyle, http://www.azlyrics.com/lyrics/drake/30for30freestyle.html
Keep The Family Close, Views, drake/keepthefamilyclose, http://www.azlyrics.com/lyrics/drake/keepthefamilyclose.html
Hype, Views, drake/hype, http://www.azlyrics.com/lyrics/drake/hype.html
With You, Views, drake/withyou, http://www.azlyrics.com/lyrics/drake/withyou.html
Controlla, Views, drake/controlla490708, http://www.azlyrics.com/lyrics/drake/controlla490708.html
Grammys, Views, drake/grammys, http://www.azlyrics.com/lyrics/drake/grammys.html
Child's Play, Views, drake/childsplay, http://www.azlyrics.com/lyrics/drake/childsplay.html
Pop Style, Views, drake/popstyle, http://www.azlyrics.com/lyrics/drake/popstyle.html
Views, Views, drake/views, http://www.azlyrics.com/lyrics/drake/views.html
No Long Talk, More Life, drake/nolongtalk, http://www.azlyrics.com/lyrics/drake/nolongtalk.html
Portland, More Life, drake/portland, http://www.azlyrics.com/lyrics/drake/portland.html
Can't Have Everything, More Life, drake/canthaveeverything, http://www.azlyrics.com/lyrics/drake/canthaveeverything.html
Glow, More Life, drake/glow, http://www.azlyrics.com/lyrics/drake/glow.html
Fake Love, More Life, drake/fakelove, http://www.azlyrics.com/lyrics/drake/fakelove.html
Ice Melts, More Life, drake/icemelts, http://www.azlyrics.com/lyrics/drake/icemelts.html
All White (Snippet), Misc: Drake, drake/allwhitesnippet, http://www.azlyrics.com/lyrics/drake/allwhitesnippet.html
Bar Mitzvah In 1999, Misc: Drake, drake/barmitzvahin1999, http://www.azlyrics.com/lyrics/drake/barmitzvahin1999.html
Believe It Or Not, Misc: Drake, drake/believeitornot, http://www.azlyrics.com/lyrics/drake/believeitornot.html
Best I Ever Had (Remix), Misc: Drake, drake/bestieverhadremix77364, http://www.azlyrics.com/lyrics/drake/bestieverhadremix77364.html
Beyond This, Misc: Drake, drake/beyondthis, http://www.azlyrics.com/lyrics/drake/beyondthis.html
Can I?, Misc: Drake, drake/cani, http://www.azlyrics.com/lyrics/drake/cani.html
Come Real, Misc: Drake, drake/comereal, http://www.azlyrics.com/lyrics/drake/comereal.html
Days In The East, Misc: Drake, drake/daysintheeast, http://www.azlyrics.com/lyrics/drake/daysintheeast.html
Do It Now, Misc: Drake, drake/doitnow, http://www.azlyrics.com/lyrics/drake/doitnow.html
Faithful (Extended Version), Misc: Drake, drake/faithfulextendedversion, http://www.azlyrics.com/lyrics/drake/faithfulextendedversion.html
Falling Up, Misc: Drake, drake/fallingup, http://www.azlyrics.com/lyrics/drake/fallingup.html
Free Spirit, Misc: Drake, drake/freespirit, http://www.azlyrics.com/lyrics/drake/freespirit.html
Heat Of The Moment, Misc: Drake, drake/heatofthemoment, http://www.azlyrics.com/lyrics/drake/heatofthemoment.html
How About Now, Misc: Drake, drake/howaboutnow, http://www.azlyrics.com/lyrics/drake/howaboutnow.html
Hype (Remix), Misc: Drake, drake/hyperemix, http://www.azlyrics.com/lyrics/drake/hyperemix.html
King Leon, Misc: Drake, drake/kingleon, http://www.azlyrics.com/lyrics/drake/kingleon.html
Lay In Bed Alone, Misc: Drake, drake/layinbedalone, http://www.azlyrics.com/lyrics/drake/layinbedalone.html
On A Wave, Misc: Drake, drake/onawave, http://www.azlyrics.com/lyrics/drake/onawave.html
Purple Flowers, Misc: Drake, drake/purpleflowers, http://www.azlyrics.com/lyrics/drake/purpleflowers.html
Same Mistakes, Misc: Drake, drake/samemistakes, http://www.azlyrics.com/lyrics/drake/samemistakes.html
Stunt Hard, Misc: Drake, drake/stunthard, http://www.azlyrics.com/lyrics/drake/stunthard.html
Summer Sixteen, Misc: Drake, drake/summersixteen, http://www.azlyrics.com/lyrics/drake/summersixteen.html
Sweeterman (Remix), Misc: Drake, drake/sweetermanremix, http://www.azlyrics.com/lyrics/drake/sweetermanremix.html
Take You Down, Misc: Drake, drake/takeyoudown, http://www.azlyrics.com/lyrics/drake/takeyoudown.html
Trophies, Misc: Drake, drake/trophies, http://www.azlyrics.com/lyrics/drake/trophies.html
Wanna Know (Remix), Misc: Drake, drake/wannaknowremix, http://www.azlyrics.com/lyrics/drake/wannaknowremix.html
What You Need, Misc: Drake, drake/whatyouneed, http://www.azlyrics.com/lyrics/drake/whatyouneed.html
Where Were You, Misc: Drake, drake/wherewereyou, http://www.azlyrics.com/lyrics/drake/wherewereyou.html
Earl, Earl, earlsweatshirt/earl, http://www.azlyrics.com/lyrics/earlsweatshirt/earl.html
Couch, Earl, earlsweatshirt/couch, http://www.azlyrics.com/lyrics/earlsweatshirt/couch.html
Kill, Earl, earlsweatshirt/kill, http://www.azlyrics.com/lyrics/earlsweatshirt/kill.html
WakeUpFaggot, Earl, earlsweatshirt/wakeupfaggot, http://www.azlyrics.com/lyrics/earlsweatshirt/wakeupfaggot.html
Luper, Earl, earlsweatshirt/luper, http://www.azlyrics.com/lyrics/earlsweatshirt/luper.html
Burgundy, Doris, earlsweatshirt/burgundy, http://www.azlyrics.com/lyrics/earlsweatshirt/burgundy.html
Hive, Doris, earlsweatshirt/hive, http://www.azlyrics.com/lyrics/earlsweatshirt/hive.html
Sasquatch, Doris, earlsweatshirt/sasquatch, http://www.azlyrics.com/lyrics/earlsweatshirt/sasquatch.html
Centurion, Doris, earlsweatshirt/centurion, http://www.azlyrics.com/lyrics/earlsweatshirt/centurion.html
Guild, Doris, earlsweatshirt/guild, http://www.azlyrics.com/lyrics/earlsweatshirt/guild.html
Molasses, Doris, earlsweatshirt/molasses, http://www.azlyrics.com/lyrics/earlsweatshirt/molasses.html
Huey, I Don't Like Shit. I Don't Go Outside, earlsweatshirt/huey, http://www.azlyrics.com/lyrics/earlsweatshirt/huey.html
Faucet, I Don't Like Shit. I Don't Go Outside, earlsweatshirt/faucet, http://www.azlyrics.com/lyrics/earlsweatshirt/faucet.html
Grief, I Don't Like Shit. I Don't Go Outside, earlsweatshirt/grief, http://www.azlyrics.com/lyrics/earlsweatshirt/grief.html
Grown Ups, I Don't Like Shit. I Don't Go Outside, earlsweatshirt/grownups, http://www.azlyrics.com/lyrics/earlsweatshirt/grownups.html
AM // Radio, I Don't Like Shit. I Don't Go Outside, earlsweatshirt/amradio, http://www.azlyrics.com/lyrics/earlsweatshirt/amradio.html
Inside, I Don't Like Shit. I Don't Go Outside, earlsweatshirt/inside, http://www.azlyrics.com/lyrics/earlsweatshirt/inside.html
DNA, I Don't Like Shit. I Don't Go Outside, earlsweatshirt/dna, http://www.azlyrics.com/lyrics/earlsweatshirt/dna.html
Drop, Misc: Earl Sweatshirt, earlsweatshirt/drop, http://www.azlyrics.com/lyrics/earlsweatshirt/drop.html
Home, Misc: Earl Sweatshirt, earlsweatshirt/home, http://www.azlyrics.com/lyrics/earlsweatshirt/home.html
Molliwopped, Misc: Earl Sweatshirt, earlsweatshirt/molliwopped, http://www.azlyrics.com/lyrics/earlsweatshirt/molliwopped.html
Infinite, Infinite, eminem/infinite, http://www.azlyrics.com/lyrics/eminem/infinite.html
W.E.G.O. (Interlude), Infinite, eminem/wegointerlude, http://www.azlyrics.com/lyrics/eminem/wegointerlude.html
Tonight, Infinite, eminem/tonight, http://www.azlyrics.com/lyrics/eminem/tonight.html
No One's Iller Than Me, Slim Shady EP, eminem/noonesillerthanme, http://www.azlyrics.com/lyrics/eminem/noonesillerthanme.html
Guilty Conscience, Slim Shady LP, eminem/guiltyconscience, http://www.azlyrics.com/lyrics/eminem/guiltyconscience.html
Brain Damage, Slim Shady LP, eminem/braindamage, http://www.azlyrics.com/lyrics/eminem/braindamage.html
Bitch (Skit), Slim Shady LP, eminem/bitchskit, http://www.azlyrics.com/lyrics/eminem/bitchskit.html
Ken Kaniff (Skit), Slim Shady LP, eminem/kenkaniffskit, http://www.azlyrics.com/lyrics/eminem/kenkaniffskit.html
Soap (Skit), Slim Shady LP, eminem/soapskit, http://www.azlyrics.com/lyrics/eminem/soapskit.html
Bad Meets Evil, Slim Shady LP, eminem/badmeetsevil, http://www.azlyrics.com/lyrics/eminem/badmeetsevil.html
Get You Mad, Slim Shady LP, eminem/getyoumad, http://www.azlyrics.com/lyrics/eminem/getyoumad.html
Who Knew, The Marshall Mathers LP, eminem/whoknew, http://www.azlyrics.com/lyrics/eminem/whoknew.html
The Way I Am, The Marshall Mathers LP, eminem/thewayiam, http://www.azlyrics.com/lyrics/eminem/thewayiam.html
Remember Me?, The Marshall Mathers LP, eminem/rememberme, http://www.azlyrics.com/lyrics/eminem/rememberme.html
I'm Back, The Marshall Mathers LP, eminem/imback, http://www.azlyrics.com/lyrics/eminem/imback.html
Marshall Mathers, The Marshall Mathers LP, eminem/marshallmathers, http://www.azlyrics.com/lyrics/eminem/marshallmathers.html
Bitch Please II, The Marshall Mathers LP, eminem/bitchpleaseii, http://www.azlyrics.com/lyrics/eminem/bitchpleaseii.html
Criminal, The Marshall Mathers LP, eminem/criminal, http://www.azlyrics.com/lyrics/eminem/criminal.html
White America, The Eminem Show, eminem/whiteamerica, http://www.azlyrics.com/lyrics/eminem/whiteamerica.html
Business, The Eminem Show, eminem/business, http://www.azlyrics.com/lyrics/eminem/business.html
Cleanin Out My Closet, The Eminem Show, eminem/cleaninoutmycloset, http://www.azlyrics.com/lyrics/eminem/cleaninoutmycloset.html
Soldier, The Eminem Show, eminem/soldier, http://www.azlyrics.com/lyrics/eminem/soldier.html
Paul Rosenberg (Skit), The Eminem Show, eminem/paulrosenbergskit, http://www.azlyrics.com/lyrics/eminem/paulrosenbergskit.html
Sing For The Moment, The Eminem Show, eminem/singforthemoment, http://www.azlyrics.com/lyrics/eminem/singforthemoment.html
My Dad's Gone Crazy, The Eminem Show, eminem/mydadsgonecrazy, http://www.azlyrics.com/lyrics/eminem/mydadsgonecrazy.html
Monkey See. Monkey Do, Straight From The Lab, eminem/monkeyseemonkeydo, http://www.azlyrics.com/lyrics/eminem/monkeyseemonkeydo.html
We As Americans, Straight From The Lab, eminem/weasamericans, http://www.azlyrics.com/lyrics/eminem/weasamericans.html
I Love You More, Straight From The Lab, eminem/iloveyoumore, http://www.azlyrics.com/lyrics/eminem/iloveyoumore.html
Bully, Straight From The Lab, eminem/bully, http://www.azlyrics.com/lyrics/eminem/bully.html
Doe Ray Me, Straight From The Lab, eminem/doerayme, http://www.azlyrics.com/lyrics/eminem/doerayme.html
Evil Deeds, Encore, eminem/evildeeds, http://www.azlyrics.com/lyrics/eminem/evildeeds.html
Rain Man, Encore, eminem/rainman, http://www.azlyrics.com/lyrics/eminem/rainman.html
Em Calls Paul (Skit), Encore, eminem/emcallspaulskit, http://www.azlyrics.com/lyrics/eminem/emcallspaulskit.html
Just Lose It, Encore, eminem/justloseit, http://www.azlyrics.com/lyrics/eminem/justloseit.html
Spend Some Time, Encore, eminem/spendsometime, http://www.azlyrics.com/lyrics/eminem/spendsometime.html
Final Thought (Skit), Encore, eminem/finalthoughtskit, http://www.azlyrics.com/lyrics/eminem/finalthoughtskit.html
Encore / Curtains Down, Encore, eminem/encorecurtainsdown, http://www.azlyrics.com/lyrics/eminem/encorecurtainsdown.html
We As Americans, Encore, eminem/weasamericans, http://www.azlyrics.com/lyrics/eminem/weasamericans.html
I Love You More, Encore, eminem/iloveyoumore, http://www.azlyrics.com/lyrics/eminem/iloveyoumore.html
Ricky Ticky Toc, Encore, eminem/rickytickytoc, http://www.azlyrics.com/lyrics/eminem/rickytickytoc.html
The Way I Am, Curtain Call, eminem/thewayiam, http://www.azlyrics.com/lyrics/eminem/thewayiam.html
Lose Yourself, Curtain Call, eminem/loseyourself, http://www.azlyrics.com/lyrics/eminem/loseyourself.html
Shake That, Curtain Call, eminem/shakethat, http://www.azlyrics.com/lyrics/eminem/shakethat.html
Sing For The Moment, Curtain Call, eminem/singforthemoment, http://www.azlyrics.com/lyrics/eminem/singforthemoment.html
Guilty Conscience, Curtain Call, eminem/guiltyconscience, http://www.azlyrics.com/lyrics/eminem/guiltyconscience.html
Cleanin Out My Closet, Curtain Call, eminem/cleaninoutmycloset, http://www.azlyrics.com/lyrics/eminem/cleaninoutmycloset.html
Just Lose It, Curtain Call, eminem/justloseit, http://www.azlyrics.com/lyrics/eminem/justloseit.html
Dead Wrong (Remix), Curtain Call, eminem/deadwrongremix, http://www.azlyrics.com/lyrics/eminem/deadwrongremix.html
Shit On You, Curtain Call, eminem/shitonyou, http://www.azlyrics.com/lyrics/eminem/shitonyou.html
Renegade, Curtain Call, eminem/renegade, http://www.azlyrics.com/lyrics/eminem/renegade.html
The Re-Up, Eminem Presents The Re-Up, eminem/thereup, http://www.azlyrics.com/lyrics/eminem/thereup.html
Jimmy Crack Corn, Eminem Presents The Re-Up, eminem/jimmycrackcorn, http://www.azlyrics.com/lyrics/eminem/jimmycrackcorn.html
Shake That (Remix), Eminem Presents The Re-Up, eminem/shakethatremix, http://www.azlyrics.com/lyrics/eminem/shakethatremix.html
No Apologies, Eminem Presents The Re-Up, eminem/noapologies, http://www.azlyrics.com/lyrics/eminem/noapologies.html
Dr. West (Skit), Relapse, eminem/drwestskit, http://www.azlyrics.com/lyrics/eminem/drwestskit.html
3 A.M., Relapse, eminem/3am, http://www.azlyrics.com/lyrics/eminem/3am.html
My Mom, Relapse, eminem/mymom, http://www.azlyrics.com/lyrics/eminem/mymom.html
Bagpipes From Baghdad, Relapse, eminem/bagpipesfrombaghdad, http://www.azlyrics.com/lyrics/eminem/bagpipesfrombaghdad.html
Hello, Relapse, eminem/hello, http://www.azlyrics.com/lyrics/eminem/hello.html
Tonya (Skit), Relapse, eminem/tonyaskit, http://www.azlyrics.com/lyrics/eminem/tonyaskit.html
Same Song & Dance, Relapse, eminem/samesongdance, http://www.azlyrics.com/lyrics/eminem/samesongdance.html
We Made You, Relapse, eminem/wemadeyou, http://www.azlyrics.com/lyrics/eminem/wemadeyou.html
Paul (Skit), Relapse, eminem/paulskit77660, http://www.azlyrics.com/lyrics/eminem/paulskit77660.html
Stay Wide Awake, Relapse, eminem/staywideawake, http://www.azlyrics.com/lyrics/eminem/staywideawake.html
Must Be The Ganja, Relapse, eminem/mustbetheganja, http://www.azlyrics.com/lyrics/eminem/mustbetheganja.html
Beautiful, Relapse, eminem/beautiful, http://www.azlyrics.com/lyrics/eminem/beautiful.html
Crack A Bottle, Relapse, eminem/crackabottle, http://www.azlyrics.com/lyrics/eminem/crackabottle.html
Steve Berman (Skit), Relapse, eminem/stevebermanskit77667, http://www.azlyrics.com/lyrics/eminem/stevebermanskit77667.html
Underground, Relapse, eminem/underground, http://www.azlyrics.com/lyrics/eminem/underground.html
My Darling, Relapse, eminem/mydarling, http://www.azlyrics.com/lyrics/eminem/mydarling.html
Music Box, Relapse: Refill, eminem/musicbox, http://www.azlyrics.com/lyrics/eminem/musicbox.html
Cold Wind Blows, Recovery, eminem/coldwindblows, http://www.azlyrics.com/lyrics/eminem/coldwindblows.html
Won't Back Down, Recovery, eminem/wontbackdown, http://www.azlyrics.com/lyrics/eminem/wontbackdown.html
W.T.P., Recovery, eminem/wtp, http://www.azlyrics.com/lyrics/eminem/wtp.html
Not Afraid, Recovery, eminem/notafraid, http://www.azlyrics.com/lyrics/eminem/notafraid.html
Seduction, Recovery, eminem/seduction, http://www.azlyrics.com/lyrics/eminem/seduction.html
Space Bound, Recovery, eminem/spacebound, http://www.azlyrics.com/lyrics/eminem/spacebound.html
Cinderella Man, Recovery, eminem/cinderellaman, http://www.azlyrics.com/lyrics/eminem/cinderellaman.html
Love The Way You Lie, Recovery, eminem/lovethewayyoulie, http://www.azlyrics.com/lyrics/eminem/lovethewayyoulie.html
Session One, Recovery, eminem/sessionone, http://www.azlyrics.com/lyrics/eminem/sessionone.html
The People's Champ (Intro), Straight From The Vault, eminem/thepeopleschampintro, http://www.azlyrics.com/lyrics/eminem/thepeopleschampintro.html
Get Money (Freestyle), Straight From The Vault, eminem/getmoneyfreestyle, http://www.azlyrics.com/lyrics/eminem/getmoneyfreestyle.html
Ballin' Uncontrollably, Straight From The Vault, eminem/ballinuncontrollably, http://www.azlyrics.com/lyrics/eminem/ballinuncontrollably.html
Wee Wee, Straight From The Vault, eminem/weewee, http://www.azlyrics.com/lyrics/eminem/weewee.html
The Apple, Straight From The Vault, eminem/theapple, http://www.azlyrics.com/lyrics/eminem/theapple.html
Bad Guy, The Marshall Mathers LP 2, eminem/badguy, http://www.azlyrics.com/lyrics/eminem/badguy.html
Rhyme Or Reason, The Marshall Mathers LP 2, eminem/rhymeorreason, http://www.azlyrics.com/lyrics/eminem/rhymeorreason.html
So Far..., The Marshall Mathers LP 2, eminem/sofar, http://www.azlyrics.com/lyrics/eminem/sofar.html
Headlights, The Marshall Mathers LP 2, eminem/headlights, http://www.azlyrics.com/lyrics/eminem/headlights.html
Evil Twin, The Marshall Mathers LP 2, eminem/eviltwin, http://www.azlyrics.com/lyrics/eminem/eviltwin.html
Beautiful Pain, The Marshall Mathers LP 2, eminem/beautifulpain, http://www.azlyrics.com/lyrics/eminem/beautifulpain.html
ShadyXV, Shady XV, eminem/shadyxv, http://www.azlyrics.com/lyrics/eminem/shadyxv.html
Y'all Ready Know, Shady XV, slaughterhouse/yallreadyknow, http://www.azlyrics.com/lyrics/slaughterhouse/yallreadyknow.html
Down, Shady XV, yelawolf/down, http://www.azlyrics.com/lyrics/yelawolf/down.html
Bane, Shady XV, d12/bane, http://www.azlyrics.com/lyrics/d12/bane.html
Fine Line, Shady XV, eminem/fineline, http://www.azlyrics.com/lyrics/eminem/fineline.html
2.0 Boys, Misc: Eminem, eminem/20boys, http://www.azlyrics.com/lyrics/eminem/20boys.html
8 Mile, Misc: Eminem, eminem/8mile, http://www.azlyrics.com/lyrics/eminem/8mile.html
8 Mile Freestyle Pt.II vs "Lotto", Misc: Eminem, eminem/8milefreestyleptiivslotto, http://www.azlyrics.com/lyrics/eminem/8milefreestyleptiivslotto.html
8 Mile Freestyle Pt.III vs "Papa Doc", Misc: Eminem, eminem/8milefreestyleptiiivspapadoc, http://www.azlyrics.com/lyrics/eminem/8milefreestyleptiiivspapadoc.html
A Drop In The Ocean, Misc: Eminem, eminem/adropintheocean, http://www.azlyrics.com/lyrics/eminem/adropintheocean.html
Bet Shady 2.0 Cypher, Misc: Eminem, eminem/betshady20cypher, http://www.azlyrics.com/lyrics/eminem/betshady20cypher.html
Biterphobia, Misc: Eminem, eminem/biterphobia, http://www.azlyrics.com/lyrics/eminem/biterphobia.html
Chonkyfire Freestyle (Swag Juice), Misc: Eminem, eminem/chonkyfirefreestyleswagjuice, http://www.azlyrics.com/lyrics/eminem/chonkyfirefreestyleswagjuice.html
Cocaine, Misc: Eminem, eminem/cocaine, http://www.azlyrics.com/lyrics/eminem/cocaine.html
Constantly Armed, Misc: Eminem, eminem/constantlyarmed, http://www.azlyrics.com/lyrics/eminem/constantlyarmed.html
Fallin, Misc: Eminem, eminem/fallin, http://www.azlyrics.com/lyrics/eminem/fallin.html
Farewell, Misc: Eminem, eminem/farewell, http://www.azlyrics.com/lyrics/eminem/farewell.html
Foolish Pride, Misc: Eminem, eminem/foolishpride, http://www.azlyrics.com/lyrics/eminem/foolishpride.html
Fubba U Cubba Kubba (Freestyle), Misc: Eminem, eminem/fubbaucubbakubbafreestyle, http://www.azlyrics.com/lyrics/eminem/fubbaucubbakubbafreestyle.html
Gone Again Pt. 2, Misc: Eminem, eminem/goneagainpt2, http://www.azlyrics.com/lyrics/eminem/goneagainpt2.html
Got Next, Misc: Eminem, eminem/gotnext, http://www.azlyrics.com/lyrics/eminem/gotnext.html
Hail Mary 2003 (Ja Rule Diss), Misc: Eminem, eminem/hailmary2003jarulediss, http://www.azlyrics.com/lyrics/eminem/hailmary2003jarulediss.html
Hailie's Revenge, Misc: Eminem, eminem/hailiesrevenge, http://www.azlyrics.com/lyrics/eminem/hailiesrevenge.html
I Need A Doctor, Misc: Eminem, drdre/ineedadoctor, http://www.azlyrics.com/lyrics/drdre/ineedadoctor.html
If I Get Locked Up Tonight, Misc: Eminem, eminem/ifigetlockeduptonight, http://www.azlyrics.com/lyrics/eminem/ifigetlockeduptonight.html
Invasion (The Realest), Misc: Eminem, eminem/invasiontherealest, http://www.azlyrics.com/lyrics/eminem/invasiontherealest.html
Just Lose It, Misc: Eminem, eminem/justloseitmusicvideoversion, http://www.azlyrics.com/lyrics/eminem/justloseitmusicvideoversion.html
Kings Never Die, Misc: Eminem, eminem/kingsneverdie, http://www.azlyrics.com/lyrics/eminem/kingsneverdie.html
Living Proof, Misc: Eminem, eminem/livingproof, http://www.azlyrics.com/lyrics/eminem/livingproof.html
Love Me, Misc: Eminem, eminem/loveme, http://www.azlyrics.com/lyrics/eminem/loveme.html
Move On, Misc: Eminem, eminem/moveon, http://www.azlyrics.com/lyrics/eminem/moveon.html
Our House, Misc: Eminem, eminem/ourhouse, http://www.azlyrics.com/lyrics/eminem/ourhouse.html
Quitter, Misc: Eminem, eminem/quitter, http://www.azlyrics.com/lyrics/eminem/quitter.html
Second Chance, Misc: Eminem, eminem/secondchance, http://www.azlyrics.com/lyrics/eminem/secondchance.html
Syllables, Misc: Eminem, eminem/syllables, http://www.azlyrics.com/lyrics/eminem/syllables.html
Symphony In H, Misc: Eminem, eminem/symphonyinh, http://www.azlyrics.com/lyrics/eminem/symphonyinh.html
The Art Of Rap (Freestyle), Misc: Eminem, eminem/theartofrapfreestyle, http://www.azlyrics.com/lyrics/eminem/theartofrapfreestyle.html
The Warning, Misc: Eminem, eminem/thewarning, http://www.azlyrics.com/lyrics/eminem/thewarning.html
