Roses, Life Is Good, nas/roses, http://www.azlyrics.com/lyrics/nas/roses.html
Affirmative Action (International Remix), Misc: Nas, nas/affirmativeactioninternationalremix, http://www.azlyrics.com/lyrics/nas/affirmativeactioninternationalremix.html
Amongst Kings, Misc: Nas, nas/amongstkings, http://www.azlyrics.com/lyrics/nas/amongstkings.html
Be A Nigger Too, Misc: Nas, nas/beaniggertoo, http://www.azlyrics.com/lyrics/nas/beaniggertoo.html
Black Man In A White World (Ghetto Gettysburg Address), Misc: Nas, nas/blackmaninawhiteworldghettogettysburgaddress, http://www.azlyrics.com/lyrics/nas/blackmaninawhiteworldghettogettysburgaddress.html
Death Anniversary, Misc: Nas, nas/deathanniversary, http://www.azlyrics.com/lyrics/nas/deathanniversary.html
Fetus (Belly Button Window), Misc: Nas, nas/fetusbellybuttonwindow, http://www.azlyrics.com/lyrics/nas/fetusbellybuttonwindow.html
Find Ya Wealth, Misc: Nas, nas/findyawealth, http://www.azlyrics.com/lyrics/nas/findyawealth.html
Good Morning, Misc: Nas, nas/goodmorning, http://www.azlyrics.com/lyrics/nas/goodmorning.html
Hardest Thing Is To Stay Alive, Misc: Nas, nas/hardestthingistostayalive, http://www.azlyrics.com/lyrics/nas/hardestthingistostayalive.html
High, Misc: Nas, nas/high, http://www.azlyrics.com/lyrics/nas/high.html
I Already Know, Misc: Nas, nas/ialreadyknow, http://www.azlyrics.com/lyrics/nas/ialreadyknow.html
It Wasn't You, Misc: Nas, nas/itwasntyou, http://www.azlyrics.com/lyrics/nas/itwasntyou.html
It's A Tower Heist, Misc: Nas, nas/itsatowerheist, http://www.azlyrics.com/lyrics/nas/itsatowerheist.html
Kids In Da PJ's, Misc: Nas, nas/kidsindapjs, http://www.azlyrics.com/lyrics/nas/kidsindapjs.html
Let 'Em Hang, Misc: Nas, nas/letemhang, http://www.azlyrics.com/lyrics/nas/letemhang.html
More Than I Can Say, Misc: Nas, nas/morethanicansay, http://www.azlyrics.com/lyrics/nas/morethanicansay.html
Nasty Nas Freestyle. Part 1, Misc: Nas, nas/nastynasfreestylepart1, http://www.azlyrics.com/lyrics/nas/nastynasfreestylepart1.html
Nasty Nas Freestyle. Part 2, Misc: Nas, nas/nastynasfreestylepart2, http://www.azlyrics.com/lyrics/nas/nastynasfreestylepart2.html
Never Gonna Give It Up, Misc: Nas, nas/nevergonnagiveitup, http://www.azlyrics.com/lyrics/nas/nevergonnagiveitup.html
One Mic (Remix), Misc: Nas, nas/onemicremix, http://www.azlyrics.com/lyrics/nas/onemicremix.html
One Never Knows, Misc: Nas, nas/oneneverknows, http://www.azlyrics.com/lyrics/nas/oneneverknows.html
One On One, Misc: Nas, nas/oneonone, http://www.azlyrics.com/lyrics/nas/oneonone.html
Oochie Wally (Remix), Misc: Nas, nas/oochiewallyremix, http://www.azlyrics.com/lyrics/nas/oochiewallyremix.html
Peace God, Misc: Nas, nas/peacegod, http://www.azlyrics.com/lyrics/nas/peacegod.html
Self Conscience, Misc: Nas, nas/selfconscience, http://www.azlyrics.com/lyrics/nas/selfconscience.html
Snitch Alibi, Misc: Nas, nas/snitchalibi, http://www.azlyrics.com/lyrics/nas/snitchalibi.html
Teenage Thug, Misc: Nas, nas/teenagethug, http://www.azlyrics.com/lyrics/nas/teenagethug.html
The Foulness, Misc: Nas, nas/thefoulness, http://www.azlyrics.com/lyrics/nas/thefoulness.html
The General (Salute Me), Misc: Nas, nas/thegeneralsaluteme, http://www.azlyrics.com/lyrics/nas/thegeneralsaluteme.html
U Wanna Be Me, Misc: Nas, nas/uwannabeme, http://www.azlyrics.com/lyrics/nas/uwannabeme.html
Westwood Classic Freestyle, Misc: Nas, nas/westwoodclassicfreestyle, http://www.azlyrics.com/lyrics/nas/westwoodclassicfreestyle.html
Where Are They Now (90's Remix), Misc: Nas, nas/wherearetheynow90sremix, http://www.azlyrics.com/lyrics/nas/wherearetheynow90sremix.html
Wrote My Way Out, Misc: Nas, nas/wrotemywayout, http://www.azlyrics.com/lyrics/nas/wrotemywayout.html
Playtime Is Over, Playtime Is Over, nickiminaj/playtimeisover, http://www.azlyrics.com/lyrics/nickiminaj/playtimeisover.html
Jump Off '07, Playtime Is Over, nickiminaj/jumpoff07, http://www.azlyrics.com/lyrics/nickiminaj/jumpoff07.html
40 Bars, Playtime Is Over, nickiminaj/40bars, http://www.azlyrics.com/lyrics/nickiminaj/40bars.html
Warning, Playtime Is Over, nickiminaj/warning, http://www.azlyrics.com/lyrics/nickiminaj/warning.html
N.I.G.G.A.S., Playtime Is Over, nickiminaj/niggas, http://www.azlyrics.com/lyrics/nickiminaj/niggas.html
Letcha Go, Playtime Is Over, nickiminaj/letchago, http://www.azlyrics.com/lyrics/nickiminaj/letchago.html
Sticks In My Bun, Playtime Is Over, nickiminaj/sticksinmybun, http://www.azlyrics.com/lyrics/nickiminaj/sticksinmybun.html
Sunshine, Sucka Free, nickiminaj/sunshine, http://www.azlyrics.com/lyrics/nickiminaj/sunshine.html
Curious George, Sucka Free, nickiminaj/curiousgeorge, http://www.azlyrics.com/lyrics/nickiminaj/curiousgeorge.html
Cuchi Shop, Sucka Free, nickiminaj/cuchishop, http://www.azlyrics.com/lyrics/nickiminaj/cuchishop.html
Young Money Ballaz, Sucka Free, nickiminaj/youngmoneyballaz, http://www.azlyrics.com/lyrics/nickiminaj/youngmoneyballaz.html
Dead Wrong, Sucka Free, nickiminaj/deadwrong, http://www.azlyrics.com/lyrics/nickiminaj/deadwrong.html
Long Time Comin', Sucka Free, nickiminaj/longtimecomin, http://www.azlyrics.com/lyrics/nickiminaj/longtimecomin.html
Womp Womp, Sucka Free, nickiminaj/wompwomp, http://www.azlyrics.com/lyrics/nickiminaj/wompwomp.html
Shopaholic, Beam Me Up Scotty, nickiminaj/shopaholic, http://www.azlyrics.com/lyrics/nickiminaj/shopaholic.html
Go Hard, Beam Me Up Scotty, nickiminaj/gohard, http://www.azlyrics.com/lyrics/nickiminaj/gohard.html
Nicki Minaj Speaks #2, Beam Me Up Scotty, nickiminaj/nickiminajspeaks2, http://www.azlyrics.com/lyrics/nickiminaj/nickiminajspeaks2.html
Best I Ever Had (Remix), Beam Me Up Scotty, nickiminaj/bestieverhadremix, http://www.azlyrics.com/lyrics/nickiminaj/bestieverhadremix.html
Handstand, Beam Me Up Scotty, nickiminaj/handstand, http://www.azlyrics.com/lyrics/nickiminaj/handstand.html
Keys Under Palm Trees, Beam Me Up Scotty, nickiminaj/keysunderpalmtrees, http://www.azlyrics.com/lyrics/nickiminaj/keysunderpalmtrees.html
Get Silly, Beam Me Up Scotty, nickiminaj/getsilly, http://www.azlyrics.com/lyrics/nickiminaj/getsilly.html
Easy, Beam Me Up Scotty, nickiminaj/easy, http://www.azlyrics.com/lyrics/nickiminaj/easy.html
Still I Rise, Beam Me Up Scotty, nickiminaj/stillirise, http://www.azlyrics.com/lyrics/nickiminaj/stillirise.html
I Feel Free, Beam Me Up Scotty, nickiminaj/ifeelfree, http://www.azlyrics.com/lyrics/nickiminaj/ifeelfree.html
Outro, Beam Me Up Scotty, nickiminaj/outro, http://www.azlyrics.com/lyrics/nickiminaj/outro.html
Barbie World (Intro), Barbie World, nickiminaj/barbieworldintro, http://www.azlyrics.com/lyrics/nickiminaj/barbieworldintro.html
Your Love, Barbie World, nickiminaj/yourlove93219, http://www.azlyrics.com/lyrics/nickiminaj/yourlove93219.html
Girlfriend, Barbie World, nickiminaj/girlfriend, http://www.azlyrics.com/lyrics/nickiminaj/girlfriend.html
Shake It For Daddy, Barbie World, nickiminaj/shakeitfordaddy, http://www.azlyrics.com/lyrics/nickiminaj/shakeitfordaddy.html
Sex In Crazy Places, Barbie World, nickiminaj/sexincrazyplaces, http://www.azlyrics.com/lyrics/nickiminaj/sexincrazyplaces.html
Grinding Getting Money, Barbie World, nickiminaj/grindinggettingmoney, http://www.azlyrics.com/lyrics/nickiminaj/grindinggettingmoney.html
Pony Tail, Barbie World, nickiminaj/ponytail, http://www.azlyrics.com/lyrics/nickiminaj/ponytail.html
The Cipher, Barbie World, nickiminaj/thecipher, http://www.azlyrics.com/lyrics/nickiminaj/thecipher.html
Eazy, Barbie World, nickiminaj/eazy, http://www.azlyrics.com/lyrics/nickiminaj/eazy.html
I'm The Best, Pink Friday, nickiminaj/imthebest, http://www.azlyrics.com/lyrics/nickiminaj/imthebest.html
Roman's Revenge, Pink Friday, nickiminaj/romansrevenge, http://www.azlyrics.com/lyrics/nickiminaj/romansrevenge.html
Did It On 'Em, Pink Friday, nickiminaj/diditonem, http://www.azlyrics.com/lyrics/nickiminaj/diditonem.html
Check It Out, Pink Friday, nickiminaj/checkitout, http://www.azlyrics.com/lyrics/nickiminaj/checkitout.html
Here I Am, Pink Friday, nickiminaj/hereiam, http://www.azlyrics.com/lyrics/nickiminaj/hereiam.html
Last Chance, Pink Friday, nickiminaj/lastchance, http://www.azlyrics.com/lyrics/nickiminaj/lastchance.html
Super Bass, Pink Friday, nickiminaj/superbass, http://www.azlyrics.com/lyrics/nickiminaj/superbass.html
Roman Holiday, Pink Friday: Roman Reloaded, nickiminaj/romanholiday, http://www.azlyrics.com/lyrics/nickiminaj/romanholiday.html
HOV Lane, Pink Friday: Roman Reloaded, nickiminaj/hovlane, http://www.azlyrics.com/lyrics/nickiminaj/hovlane.html
Champion, Pink Friday: Roman Reloaded, nickiminaj/champion, http://www.azlyrics.com/lyrics/nickiminaj/champion.html
Right By My Side, Pink Friday: Roman Reloaded, nickiminaj/rightbymyside, http://www.azlyrics.com/lyrics/nickiminaj/rightbymyside.html
Starships, Pink Friday: Roman Reloaded, nickiminaj/starships, http://www.azlyrics.com/lyrics/nickiminaj/starships.html
Pound The Alarm, Pink Friday: Roman Reloaded, nickiminaj/poundthealarm, http://www.azlyrics.com/lyrics/nickiminaj/poundthealarm.html
Whip It, Pink Friday: Roman Reloaded, nickiminaj/whipit, http://www.azlyrics.com/lyrics/nickiminaj/whipit.html
Beautiful Sinner, Pink Friday: Roman Reloaded, nickiminaj/beautifulsinner, http://www.azlyrics.com/lyrics/nickiminaj/beautifulsinner.html
Gun Shot, Pink Friday: Roman Reloaded, nickiminaj/gunshot, http://www.azlyrics.com/lyrics/nickiminaj/gunshot.html
Turn Me On, Pink Friday: Roman Reloaded, davidguetta/turningmeon, http://www.azlyrics.com/lyrics/davidguetta/turningmeon.html
Va Va Voom, Pink Friday: Roman Reloaded, nickiminaj/vavavoom, http://www.azlyrics.com/lyrics/nickiminaj/vavavoom.html
Masquerade, Pink Friday: Roman Reloaded, nickiminaj/masquerade, http://www.azlyrics.com/lyrics/nickiminaj/masquerade.html
Freedom, Pink Friday: Roman Reloaded - The Re-Up, nickiminaj/freedom, http://www.azlyrics.com/lyrics/nickiminaj/freedom.html
I'm Legit, Pink Friday: Roman Reloaded - The Re-Up, nickiminaj/imlegit, http://www.azlyrics.com/lyrics/nickiminaj/imlegit.html
Va Va Voom, Pink Friday: Roman Reloaded - The Re-Up, nickiminaj/vavavoom, http://www.azlyrics.com/lyrics/nickiminaj/vavavoom.html
All Things Go, The Pinkprint, nickiminaj/allthingsgo, http://www.azlyrics.com/lyrics/nickiminaj/allthingsgo.html
I Lied, The Pinkprint, nickiminaj/ilied, http://www.azlyrics.com/lyrics/nickiminaj/ilied.html
Four Door Aventador, The Pinkprint, nickiminaj/fourdooraventador, http://www.azlyrics.com/lyrics/nickiminaj/fourdooraventador.html
Trini Dem Girls, The Pinkprint, nickiminaj/trinidemgirls, http://www.azlyrics.com/lyrics/nickiminaj/trinidemgirls.html
Truffle Butter, The Pinkprint, nickiminaj/trufflebutter, http://www.azlyrics.com/lyrics/nickiminaj/trufflebutter.html
Mona Lisa, The Pinkprint, nickiminaj/monalisa, http://www.azlyrics.com/lyrics/nickiminaj/monalisa.html
Put You In A Room, The Pinkprint, nickiminaj/putyouinaroom, http://www.azlyrics.com/lyrics/nickiminaj/putyouinaroom.html
Ain't Gone Do It, Misc: Nicki Minaj, nickiminaj/aintgonedoit, http://www.azlyrics.com/lyrics/nickiminaj/aintgonedoit.html
Beef Stew, Misc: Nicki Minaj, nickiminaj/beefstew, http://www.azlyrics.com/lyrics/nickiminaj/beefstew.html
Bom Bidi Bom, Misc: Nicki Minaj, nickjonas/bombidibom, http://www.azlyrics.com/lyrics/nickjonas/bombidibom.html
Boss Ass Bitch (Remix), Misc: Nicki Minaj, nickiminaj/bossassbitchremix, http://www.azlyrics.com/lyrics/nickiminaj/bossassbitchremix.html
Cupid's Got A Gun, Misc: Nicki Minaj, nickiminaj/cupidsgotagun, http://www.azlyrics.com/lyrics/nickiminaj/cupidsgotagun.html
Flawless (Remix), Misc: Nicki Minaj, beyonceknowles/flawlessremix, http://www.azlyrics.com/lyrics/beyonceknowles/flawlessremix.html
Ice Cream Man, Misc: Nicki Minaj, nickiminaj/icecreamman, http://www.azlyrics.com/lyrics/nickiminaj/icecreamman.html
Make A Baby, Misc: Nicki Minaj, nickiminaj/makeababy, http://www.azlyrics.com/lyrics/nickiminaj/makeababy.html
Massive Attack, Misc: Nicki Minaj, nickiminaj/massiveattack, http://www.azlyrics.com/lyrics/nickiminaj/massiveattack.html
Murda Murda, Misc: Nicki Minaj, nickiminaj/murdamurda, http://www.azlyrics.com/lyrics/nickiminaj/murdamurda.html
No Flex Zone (Remix), Misc: Nicki Minaj, nickiminaj/noflexzoneremix, http://www.azlyrics.com/lyrics/nickiminaj/noflexzoneremix.html
Regret In Your Tears, Misc: Nicki Minaj, nickiminaj/regretinyourtears, http://www.azlyrics.com/lyrics/nickiminaj/regretinyourtears.html
Supa Hot, Misc: Nicki Minaj, nickiminaj/supahot, http://www.azlyrics.com/lyrics/nickiminaj/supahot.html
Tambourine, Misc: Nicki Minaj, nickiminaj/tambourine, http://www.azlyrics.com/lyrics/nickiminaj/tambourine.html
Watch What You Say, Misc: Nicki Minaj, nickiminaj/watchwhatyousay, http://www.azlyrics.com/lyrics/nickiminaj/watchwhatyousay.html
Zonin', Misc: Nicki Minaj, nickiminaj/zonin, http://www.azlyrics.com/lyrics/nickiminaj/zonin.html
Drink It Up, N.W.A. And The Posse, nwa/drinkitup, http://www.azlyrics.com/lyrics/nwa/drinkitup.html
Panic Zone, N.W.A. And The Posse, nwa/paniczone, http://www.azlyrics.com/lyrics/nwa/paniczone.html
Tuffest Man Alive, N.W.A. And The Posse, nwa/tuffestmanalive, http://www.azlyrics.com/lyrics/nwa/tuffestmanalive.html
8 Ball (Remix), Straight Outta Compton, nwa/8ballremix, http://www.azlyrics.com/lyrics/nwa/8ballremix.html
I Ain't Tha 1, Straight Outta Compton, nwa/iainttha1, http://www.azlyrics.com/lyrics/nwa/iainttha1.html
Dopeman (Remix), Straight Outta Compton, nwa/dopemanremix, http://www.azlyrics.com/lyrics/nwa/dopemanremix.html
Something 2 Dance 2, Straight Outta Compton, nwa/something2dance2, http://www.azlyrics.com/lyrics/nwa/something2dance2.html
Just Don't Bite It, 100 Miles And Runnin', nwa/justdontbiteit, http://www.azlyrics.com/lyrics/nwa/justdontbiteit.html
Sa Prize (Part 2), 100 Miles And Runnin', nwa/saprizepart2, http://www.azlyrics.com/lyrics/nwa/saprizepart2.html
Real Niggaz, 100 Miles And Runnin', nwa/realniggaz, http://www.azlyrics.com/lyrics/nwa/realniggaz.html
Real Niggaz Don't Die, Efil4zaggin, nwa/realniggazdontdie, http://www.azlyrics.com/lyrics/nwa/realniggazdontdie.html
Niggaz 4 Life, Efil4zaggin, nwa/niggaz4life, http://www.azlyrics.com/lyrics/nwa/niggaz4life.html
Appetite For Destruction, Efil4zaggin, nwa/appetitefordestruction, http://www.azlyrics.com/lyrics/nwa/appetitefordestruction.html
Always Into Somethin', Efil4zaggin, nwa/alwaysintosomethin, http://www.azlyrics.com/lyrics/nwa/alwaysintosomethin.html
Real Niggaz, Efil4zaggin, nwa/realniggaz, http://www.azlyrics.com/lyrics/nwa/realniggaz.html
I'd Rather Fuck You, Efil4zaggin, nwa/idratherfuckyou, http://www.azlyrics.com/lyrics/nwa/idratherfuckyou.html
Approach To Danger, Efil4zaggin, nwa/approachtodanger, http://www.azlyrics.com/lyrics/nwa/approachtodanger.html
Beauty And The Beat, Hot Cool & Vicious, saltnpepa/beautyandthebeat, http://www.azlyrics.com/lyrics/saltnpepa/beautyandthebeat.html
I'll Take Your Man, Hot Cool & Vicious, saltnpepa/illtakeyourman, http://www.azlyrics.com/lyrics/saltnpepa/illtakeyourman.html
Chick On The Side (Remix), Hot Cool & Vicious, saltnpepa/chickonthesideremix, http://www.azlyrics.com/lyrics/saltnpepa/chickonthesideremix.html
I Desire, Hot Cool & Vicious, saltnpepa/idesire, http://www.azlyrics.com/lyrics/saltnpepa/idesire.html
Shake Your Thang, A Salt With A Deadly Pepa, saltnpepa/shakeyourthang, http://www.azlyrics.com/lyrics/saltnpepa/shakeyourthang.html
Let The Rhythm Run (Remix), A Salt With A Deadly Pepa, saltnpepa/lettherhythmrunremix, http://www.azlyrics.com/lyrics/saltnpepa/lettherhythmrunremix.html
Get Up Everybody (Get Up), A Salt With A Deadly Pepa, saltnpepa/getupeverybodygetup, http://www.azlyrics.com/lyrics/saltnpepa/getupeverybodygetup.html
Spinderella's Not A Fella (But A Girl DJ), A Salt With A Deadly Pepa, saltnpepa/spinderellasnotafellabutagirldj, http://www.azlyrics.com/lyrics/saltnpepa/spinderellasnotafellabutagirldj.html
Soul Power (Syncopated Soul), A Salt With A Deadly Pepa, saltnpepa/soulpowersyncopatedsoul, http://www.azlyrics.com/lyrics/saltnpepa/soulpowersyncopatedsoul.html
Doper Than Dope, Blacks' Magic, saltnpepa/doperthandope, http://www.azlyrics.com/lyrics/saltnpepa/doperthandope.html
Negro Wit' An Ego, Blacks' Magic, saltnpepa/negrowitanego, http://www.azlyrics.com/lyrics/saltnpepa/negrowitanego.html
Let's Talk About Sex, Blacks' Magic, saltnpepa/letstalkaboutsex, http://www.azlyrics.com/lyrics/saltnpepa/letstalkaboutsex.html
Live & Let Die, Blacks' Magic, saltnpepa/liveletdie, http://www.azlyrics.com/lyrics/saltnpepa/liveletdie.html
Groove Me, Very Necessary, saltnpepa/grooveme, http://www.azlyrics.com/lyrics/saltnpepa/grooveme.html
Somebody's Gettin' On My Nerves, Very Necessary, saltnpepa/somebodysgettinonmynerves, http://www.azlyrics.com/lyrics/saltnpepa/somebodysgettinonmynerves.html
None Of Your Business, Very Necessary, saltnpepa/noneofyourbusiness, http://www.azlyrics.com/lyrics/saltnpepa/noneofyourbusiness.html
Shoop, Very Necessary, saltnpepa/shoop, http://www.azlyrics.com/lyrics/saltnpepa/shoop.html
Somma Time Man, Very Necessary, saltnpepa/sommatimeman, http://www.azlyrics.com/lyrics/saltnpepa/sommatimeman.html
Break Of Dawn, Very Necessary, saltnpepa/breakofdawn, http://www.azlyrics.com/lyrics/saltnpepa/breakofdawn.html
Do Me Right, Brand New, saltnpepa/domeright, http://www.azlyrics.com/lyrics/saltnpepa/domeright.html
Friends, Brand New, saltnpepa/friends, http://www.azlyrics.com/lyrics/saltnpepa/friends.html
Imagine, Brand New, saltnpepa/imagine, http://www.azlyrics.com/lyrics/saltnpepa/imagine.html
Knock Knock, Brand New, saltnpepa/knockknock, http://www.azlyrics.com/lyrics/saltnpepa/knockknock.html
Gitty Up, Brand New, saltnpepa/gittyup, http://www.azlyrics.com/lyrics/saltnpepa/gittyup.html
The Clock Is Tickin', Brand New, saltnpepa/theclockistickin, http://www.azlyrics.com/lyrics/saltnpepa/theclockistickin.html
Figg Get Da Money, Setbacks, schoolboyq/figggetdamoney, http://www.azlyrics.com/lyrics/schoolboyq/figggetdamoney.html
Kamikaze, Setbacks, schoolboyq/kamikaze, http://www.azlyrics.com/lyrics/schoolboyq/kamikaze.html
What's The Word, Setbacks, schoolboyq/whatstheword, http://www.azlyrics.com/lyrics/schoolboyq/whatstheword.html
iBETiGOTSUMWEED, Setbacks, schoolboyq/ibetigotsumweed, http://www.azlyrics.com/lyrics/schoolboyq/ibetigotsumweed.html
Druggys Wit Hoes, Setbacks, schoolboyq/druggyswithoes, http://www.azlyrics.com/lyrics/schoolboyq/druggyswithoes.html
Cycle, Setbacks, schoolboyq/cycle, http://www.azlyrics.com/lyrics/schoolboyq/cycle.html
To tHa Beat (F'd Up), Setbacks, schoolboyq/tothabeatfdup, http://www.azlyrics.com/lyrics/schoolboyq/tothabeatfdup.html
Phenomenon, Setbacks, schoolboyq/phenomenon, http://www.azlyrics.com/lyrics/schoolboyq/phenomenon.html
I'm Good, Setbacks, schoolboyq/imgood, http://www.azlyrics.com/lyrics/schoolboyq/imgood.html
There He Go, Habits & Contradictions, schoolboyq/therehego, http://www.azlyrics.com/lyrics/schoolboyq/therehego.html
Sex Drive, Habits & Contradictions, schoolboyq/sexdrive, http://www.azlyrics.com/lyrics/schoolboyq/sexdrive.html
My Hatin' Joint, Habits & Contradictions, schoolboyq/myhatinjoint, http://www.azlyrics.com/lyrics/schoolboyq/myhatinjoint.html
Tookie Knows (Interlude), Habits & Contradictions, schoolboyq/tookieknowsinterlude, http://www.azlyrics.com/lyrics/schoolboyq/tookieknowsinterlude.html
Gangsta In Designer (No Concept), Habits & Contradictions, schoolboyq/gangstaindesignernoconcept, http://www.azlyrics.com/lyrics/schoolboyq/gangstaindesignernoconcept.html
How We Feeling, Habits & Contradictions, schoolboyq/howwefeeling, http://www.azlyrics.com/lyrics/schoolboyq/howwefeeling.html
My Homie, Habits & Contradictions, schoolboyq/myhomie, http://www.azlyrics.com/lyrics/schoolboyq/myhomie.html
2 Raw, Habits & Contradictions, schoolboyq/2raw, http://www.azlyrics.com/lyrics/schoolboyq/2raw.html
Collard Greens, Oxymoron, schoolboyq/collardgreens, http://www.azlyrics.com/lyrics/schoolboyq/collardgreens.html
The Purge, Oxymoron, schoolboyq/thepurge, http://www.azlyrics.com/lyrics/schoolboyq/thepurge.html
Blind Threats, Oxymoron, schoolboyq/blindthreats, http://www.azlyrics.com/lyrics/schoolboyq/blindthreats.html
Break The Bank, Oxymoron, schoolboyq/breakthebank, http://www.azlyrics.com/lyrics/schoolboyq/breakthebank.html
His & Her Friend, Oxymoron, schoolboyq/hisherfriend, http://www.azlyrics.com/lyrics/schoolboyq/hisherfriend.html
Drugs, Schoolboy Q 2, schoolboyq/drugs, http://www.azlyrics.com/lyrics/schoolboyq/drugs.html
Friends, Schoolboy Q 2, schoolboyq/friends, http://www.azlyrics.com/lyrics/schoolboyq/friends.html
TorcH, Blank Face LP, schoolboyq/torch, http://www.azlyrics.com/lyrics/schoolboyq/torch.html
THat Part, Blank Face LP, schoolboyq/thatpart, http://www.azlyrics.com/lyrics/schoolboyq/thatpart.html
Kno Ya Wrong, Blank Face LP, schoolboyq/knoyawrong, http://www.azlyrics.com/lyrics/schoolboyq/knoyawrong.html
Big Body, Blank Face LP, schoolboyq/bigbody, http://www.azlyrics.com/lyrics/schoolboyq/bigbody.html
Neva CHange, Blank Face LP, schoolboyq/nevachange, http://www.azlyrics.com/lyrics/schoolboyq/nevachange.html
Str8 Ballin, Blank Face LP, schoolboyq/str8ballin, http://www.azlyrics.com/lyrics/schoolboyq/str8ballin.html
Black THougHts, Blank Face LP, schoolboyq/blackthoughts, http://www.azlyrics.com/lyrics/schoolboyq/blackthoughts.html
Banger (MOSHPIT), Misc: Schoolboy Q, schoolboyq/bangermoshpit, http://www.azlyrics.com/lyrics/schoolboyq/bangermoshpit.html
Hands On The Wheel (Remix), Misc: Schoolboy Q, schoolboyq/handsonthewheelremix, http://www.azlyrics.com/lyrics/schoolboyq/handsonthewheelremix.html
Y'all Ready Know, Misc: Slaughterhouse, slaughterhouse/yallreadyknow, http://www.azlyrics.com/lyrics/slaughterhouse/yallreadyknow.html
Lodi Dodi Intro, Doggystyle, snoopdogg/lodidodiintro, http://www.azlyrics.com/lyrics/snoopdogg/lodidodiintro.html
Chronic Break, Doggystyle, snoopdogg/chronicbreak, http://www.azlyrics.com/lyrics/snoopdogg/chronicbreak.html
Gz And Hustlas, Doggystyle, snoopdogg/gzandhustlas, http://www.azlyrics.com/lyrics/snoopdogg/gzandhustlas.html
U Betta Recognize (Pump Pump Intro), Doggystyle, snoopdogg/ubettarecognizepumppumpintro, http://www.azlyrics.com/lyrics/snoopdogg/ubettarecognizepumppumpintro.html
Pump Pump, Doggystyle, snoopdogg/pumppump, http://www.azlyrics.com/lyrics/snoopdogg/pumppump.html
Tha Doggfather, Tha Doggfather, snoopdogg/thadoggfather, http://www.azlyrics.com/lyrics/snoopdogg/thadoggfather.html
Up Jump Tha Boogie, Tha Doggfather, snoopdogg/upjumpthaboogie, http://www.azlyrics.com/lyrics/snoopdogg/upjumpthaboogie.html
Snoop Bounce, Tha Doggfather, snoopdogg/snoopbounce, http://www.azlyrics.com/lyrics/snoopdogg/snoopbounce.html
Gold Rush, Tha Doggfather, snoopdogg/goldrush, http://www.azlyrics.com/lyrics/snoopdogg/goldrush.html
2001, Tha Doggfather, snoopdogg/2001, http://www.azlyrics.com/lyrics/snoopdogg/2001.html
(O.J.) Wake Up, Tha Doggfather, snoopdogg/ojwakeup, http://www.azlyrics.com/lyrics/snoopdogg/ojwakeup.html
Downtown Assassins, Tha Doggfather, snoopdogg/downtownassassins, http://www.azlyrics.com/lyrics/snoopdogg/downtownassassins.html
Slow Down, The Game Is To Be Sold. Not To Be Told, snoopdogg/slowdown, http://www.azlyrics.com/lyrics/snoopdogg/slowdown.html
Hustle & Ball, The Game Is To Be Sold. Not To Be Told, snoopdogg/hustleball, http://www.azlyrics.com/lyrics/snoopdogg/hustleball.html
Don't Let Go, The Game Is To Be Sold. Not To Be Told, snoopdogg/dontletgo, http://www.azlyrics.com/lyrics/snoopdogg/dontletgo.html
Tru Tank Dogs, The Game Is To Be Sold. Not To Be Told, snoopdogg/trutankdogs, http://www.azlyrics.com/lyrics/snoopdogg/trutankdogs.html
20 Dollars To My Name, The Game Is To Be Sold. Not To Be Told, snoopdogg/20dollarstomyname, http://www.azlyrics.com/lyrics/snoopdogg/20dollarstomyname.html
Ain't Nut'in Personal, The Game Is To Be Sold. Not To Be Told, snoopdogg/aintnutinpersonal, http://www.azlyrics.com/lyrics/snoopdogg/aintnutinpersonal.html
DP Gangsta, The Game Is To Be Sold. Not To Be Told, snoopdogg/dpgangsta, http://www.azlyrics.com/lyrics/snoopdogg/dpgangsta.html
See Ya When I Get There, The Game Is To Be Sold. Not To Be Told, snoopdogg/seeyawhenigetthere, http://www.azlyrics.com/lyrics/snoopdogg/seeyawhenigetthere.html
Picture This, The Game Is To Be Sold. Not To Be Told, snoopdogg/picturethis, http://www.azlyrics.com/lyrics/snoopdogg/picturethis.html
Hoes. Money. And Clout, The Game Is To Be Sold. Not To Be Told, snoopdogg/hoesmoneyandclout, http://www.azlyrics.com/lyrics/snoopdogg/hoesmoneyandclout.html
Buck 'Em, No Limit Top Dogg, snoopdogg/buckem, http://www.azlyrics.com/lyrics/snoopdogg/buckem.html
G Bedtime Stories, No Limit Top Dogg, snoopdogg/gbedtimestories, http://www.azlyrics.com/lyrics/snoopdogg/gbedtimestories.html
Betta Days, No Limit Top Dogg, snoopdogg/bettadays, http://www.azlyrics.com/lyrics/snoopdogg/bettadays.html
Doin' Too Much, No Limit Top Dogg, snoopdogg/dointoomuch, http://www.azlyrics.com/lyrics/snoopdogg/dointoomuch.html
Ghetto Symphony, No Limit Top Dogg, snoopdogg/ghettosymphony, http://www.azlyrics.com/lyrics/snoopdogg/ghettosymphony.html
Party With A D.P.G, No Limit Top Dogg, snoopdogg/partywithadpg, http://www.azlyrics.com/lyrics/snoopdogg/partywithadpg.html
Snoop Dogg, Tha Last Meal, snoopdogg/snoopdogg, http://www.azlyrics.com/lyrics/snoopdogg/snoopdogg.html
True Lies, Tha Last Meal, snoopdogg/truelies, http://www.azlyrics.com/lyrics/snoopdogg/truelies.html
Game Court, Tha Last Meal, snoopdogg/gamecourt, http://www.azlyrics.com/lyrics/snoopdogg/gamecourt.html
Issues, Tha Last Meal, snoopdogg/issues, http://www.azlyrics.com/lyrics/snoopdogg/issues.html
Ready 2 Ryde, Tha Last Meal, snoopdogg/ready2ryde, http://www.azlyrics.com/lyrics/snoopdogg/ready2ryde.html
Loosen' Control, Tha Last Meal, snoopdogg/loosencontrol, http://www.azlyrics.com/lyrics/snoopdogg/loosencontrol.html
I Can't Swim, Tha Last Meal, snoopdogg/icantswim, http://www.azlyrics.com/lyrics/snoopdogg/icantswim.html
