Feenin Freestyle, Misc: Lil Uzi Vert, liluzivert/feeninfreestyle, http://www.azlyrics.com/lyrics/liluzivert/feeninfreestyle.html
Flex'n, Misc: Lil Uzi Vert, liluzivert/flexn, http://www.azlyrics.com/lyrics/liluzivert/flexn.html
He Did It, Misc: Lil Uzi Vert, liluzivert/hedidit, http://www.azlyrics.com/lyrics/liluzivert/hedidit.html
I Can't Lose, Misc: Lil Uzi Vert, liluzivert/icantlose, http://www.azlyrics.com/lyrics/liluzivert/icantlose.html
JuiceMan, Misc: Lil Uzi Vert, liluzivert/juiceman, http://www.azlyrics.com/lyrics/liluzivert/juiceman.html
Left Right, Misc: Lil Uzi Vert, liluzivert/leftright, http://www.azlyrics.com/lyrics/liluzivert/leftright.html
Miss Cleo, Misc: Lil Uzi Vert, liluzivert/misscleo, http://www.azlyrics.com/lyrics/liluzivert/misscleo.html
Motorola, Misc: Lil Uzi Vert, liluzivert/motorola, http://www.azlyrics.com/lyrics/liluzivert/motorola.html
On My Line, Misc: Lil Uzi Vert, liluzivert/onmyline, http://www.azlyrics.com/lyrics/liluzivert/onmyline.html
Smoke My Dope, Misc: Lil Uzi Vert, liluzivert/smokemydope, http://www.azlyrics.com/lyrics/liluzivert/smokemydope.html
So Hit, Misc: Lil Uzi Vert, liluzivert/sohit, http://www.azlyrics.com/lyrics/liluzivert/sohit.html
Stole Your Luv, Misc: Lil Uzi Vert, liluzivert/stoleyourluv, http://www.azlyrics.com/lyrics/liluzivert/stoleyourluv.html
That's My Rule, Misc: Lil Uzi Vert, liluzivert/thatsmyrule, http://www.azlyrics.com/lyrics/liluzivert/thatsmyrule.html
Thugger Voice, Misc: Lil Uzi Vert, liluzivert/thuggervoice, http://www.azlyrics.com/lyrics/liluzivert/thuggervoice.html
Yea Hoe, Misc: Lil Uzi Vert, liluzivert/yeahoe, http://www.azlyrics.com/lyrics/liluzivert/yeahoe.html
Wanna Be Us, Lil Boat, lilyachty/wannabeus, http://www.azlyrics.com/lyrics/lilyachty/wannabeus.html
Not My Bro, Lil Boat, lilyachty/notmybro, http://www.azlyrics.com/lyrics/lilyachty/notmybro.html
Good Day, Lil Boat, lilyachty/goodday, http://www.azlyrics.com/lyrics/lilyachty/goodday.html
Up Next 2, Lil Boat, lilyachty/upnext2, http://www.azlyrics.com/lyrics/lilyachty/upnext2.html
For Hot 97, Summer Songs 2, lilyachty/forhot97, http://www.azlyrics.com/lyrics/lilyachty/forhot97.html
IDK, Summer Songs 2, lilyachty/idk, http://www.azlyrics.com/lyrics/lilyachty/idk.html
Why? (Interlude), Summer Songs 2, lilyachty/whyinterlude, http://www.azlyrics.com/lyrics/lilyachty/whyinterlude.html
So Many People, Summer Songs 2, lilyachty/somanypeople, http://www.azlyrics.com/lyrics/lilyachty/somanypeople.html
Peek A Boo, Teenage Emotions, lilyachty/peekaboo, http://www.azlyrics.com/lyrics/lilyachty/peekaboo.html
22, Misc: Lil Yachty, lilyachty/22, http://www.azlyrics.com/lyrics/lilyachty/22.html
Adore Me, Misc: Lil Yachty, lilyachty/adoreme, http://www.azlyrics.com/lyrics/lilyachty/adoreme.html
All Times, Misc: Lil Yachty, lilyachty/alltimes, http://www.azlyrics.com/lyrics/lilyachty/alltimes.html
Bitter Sweet, Misc: Lil Yachty, lilyachty/bittersweet, http://www.azlyrics.com/lyrics/lilyachty/bittersweet.html
Boat Time, Misc: Lil Yachty, lilyachty/boattime, http://www.azlyrics.com/lyrics/lilyachty/boattime.html
Come Up, Misc: Lil Yachty, lilyachty/comeup, http://www.azlyrics.com/lyrics/lilyachty/comeup.html
Drippin, Misc: Lil Yachty, lilyachty/drippin, http://www.azlyrics.com/lyrics/lilyachty/drippin.html
Flexin On My Ex's, Misc: Lil Yachty, lilyachty/flexinonmyexs, http://www.azlyrics.com/lyrics/lilyachty/flexinonmyexs.html
Follies, Misc: Lil Yachty, lilyachty/follies, http://www.azlyrics.com/lyrics/lilyachty/follies.html
Fuck Up A Sack, Misc: Lil Yachty, lilyachty/fuckupasack, http://www.azlyrics.com/lyrics/lilyachty/fuckupasack.html
Hella O's, Misc: Lil Yachty, lilyachty/hellaos, http://www.azlyrics.com/lyrics/lilyachty/hellaos.html
Here We Go, Misc: Lil Yachty, lilyachty/herewego, http://www.azlyrics.com/lyrics/lilyachty/herewego.html
I Don't Fuck With Niggas, Misc: Lil Yachty, lilyachty/idontfuckwithniggas, http://www.azlyrics.com/lyrics/lilyachty/idontfuckwithniggas.html
It Takes Two, Misc: Lil Yachty, lilyachty/ittakestwo, http://www.azlyrics.com/lyrics/lilyachty/ittakestwo.html
Mamacita, Misc: Lil Yachty, lilyachty/mamacita, http://www.azlyrics.com/lyrics/lilyachty/mamacita.html
Minnesota (Remix), Misc: Lil Yachty, playboi-carti/minnesotaremix, http://www.azlyrics.com/lyrics/playboi-carti/minnesotaremix.html
No Going Steady, Misc: Lil Yachty, lilyachty/nogoingsteady, http://www.azlyrics.com/lyrics/lilyachty/nogoingsteady.html
Saving You, Misc: Lil Yachty, lilyachty/savingyou, http://www.azlyrics.com/lyrics/lilyachty/savingyou.html
They Lookin, Misc: Lil Yachty, lilyachty/theylookin, http://www.azlyrics.com/lyrics/lilyachty/theylookin.html
Truck Loads, Misc: Lil Yachty, offset/truckloads, http://www.azlyrics.com/lyrics/offset/truckloads.html
Up Next, Misc: Lil Yachty, lilyachty/upnext, http://www.azlyrics.com/lyrics/lilyachty/upnext.html
We Got It, Misc: Lil Yachty, lilyachty/wegotit, http://www.azlyrics.com/lyrics/lilyachty/wegotit.html
What's My Name, Misc: Lil Yachty, lilyachty/whatsmyname, http://www.azlyrics.com/lyrics/lilyachty/whatsmyname.html
You Gon See, Misc: Lil Yachty, lilyachty/yougonsee, http://www.azlyrics.com/lyrics/lilyachty/yougonsee.html
U Got A Problem?, Back For The First Time, ludacris/ugotaproblem, http://www.azlyrics.com/lyrics/ludacris/ugotaproblem.html
Game Got Switched, Back For The First Time, ludacris/gamegotswitched, http://www.azlyrics.com/lyrics/ludacris/gamegotswitched.html
1st & 10, Back For The First Time, ludacris/1st10, http://www.azlyrics.com/lyrics/ludacris/1st10.html
Get Off Me, Back For The First Time, ludacris/getoffme, http://www.azlyrics.com/lyrics/ludacris/getoffme.html
Southern Hospitality, Back For The First Time, ludacris/southernhospitality, http://www.azlyrics.com/lyrics/ludacris/southernhospitality.html
Rock And A Hard Place, Back For The First Time, ludacris/rockandahardplace, http://www.azlyrics.com/lyrics/ludacris/rockandahardplace.html
Coming 2 America, Word Of Mouf, ludacris/coming2america, http://www.azlyrics.com/lyrics/ludacris/coming2america.html
Go 2 Sleep, Word Of Mouf, ludacris/go2sleep, http://www.azlyrics.com/lyrics/ludacris/go2sleep.html
Area Codes, Word Of Mouf, ludacris/areacodes, http://www.azlyrics.com/lyrics/ludacris/areacodes.html
Growing Pains, Word Of Mouf, ludacris/growingpains, http://www.azlyrics.com/lyrics/ludacris/growingpains.html
Keep It On The Hush, Word Of Mouf, ludacris/keepitonthehush, http://www.azlyrics.com/lyrics/ludacris/keepitonthehush.html
Word Of Mouf (Freestyle), Word Of Mouf, ludacris/wordofmouffreestyle, http://www.azlyrics.com/lyrics/ludacris/wordofmouffreestyle.html
Get The Fuck Back, Word Of Mouf, ludacris/getthefuckback, http://www.azlyrics.com/lyrics/ludacris/getthefuckback.html
Block Lockdown, Word Of Mouf, ludacris/blocklockdown, http://www.azlyrics.com/lyrics/ludacris/blocklockdown.html
Southern Fried Intro, Chicken N Beer, ludacris/southernfriedintro, http://www.azlyrics.com/lyrics/ludacris/southernfriedintro.html
Stand Up, Chicken N Beer, ludacris/standup, http://www.azlyrics.com/lyrics/ludacris/standup.html
T Baggin' Skit, Chicken N Beer, ludacris/tbagginskit, http://www.azlyrics.com/lyrics/ludacris/tbagginskit.html
Teamwork, Chicken N Beer, ludacris/teamwork, http://www.azlyrics.com/lyrics/ludacris/teamwork.html
We Got, Chicken N Beer, ludacris/wegot, http://www.azlyrics.com/lyrics/ludacris/wegot.html
Get Back, Red Light District, ludacris/getback, http://www.azlyrics.com/lyrics/ludacris/getback.html
Child Of The Night, Red Light District, ludacris/childofthenight, http://www.azlyrics.com/lyrics/ludacris/childofthenight.html
Pass Out, Red Light District, ludacris/passout, http://www.azlyrics.com/lyrics/ludacris/passout.html
Large Amounts, Red Light District, ludacris/largeamounts, http://www.azlyrics.com/lyrics/ludacris/largeamounts.html
Pimpin' All Over The World, Red Light District, ludacris/pimpinallovertheworld, http://www.azlyrics.com/lyrics/ludacris/pimpinallovertheworld.html
Virgo, Red Light District, ludacris/virgo, http://www.azlyrics.com/lyrics/ludacris/virgo.html
Grew Up A Screw Up, Release Therapy, ludacris/grewupascrewup, http://www.azlyrics.com/lyrics/ludacris/grewupascrewup.html
End Of The Night, Release Therapy, ludacris/endofthenight, http://www.azlyrics.com/lyrics/ludacris/endofthenight.html
Tell It Like It Is, Release Therapy, ludacris/tellitlikeitis, http://www.azlyrics.com/lyrics/ludacris/tellitlikeitis.html
War With God, Release Therapy, ludacris/warwithgod, http://www.azlyrics.com/lyrics/ludacris/warwithgod.html
Intro, Theater Of The Mind, ludacris/intro74072, http://www.azlyrics.com/lyrics/ludacris/intro74072.html
One More Drink, Theater Of The Mind, ludacris/onemoredrink, http://www.azlyrics.com/lyrics/ludacris/onemoredrink.html
Southern Gangsta, Theater Of The Mind, ludacris/southerngangsta, http://www.azlyrics.com/lyrics/ludacris/southerngangsta.html
Everybody Hates Chris, Theater Of The Mind, ludacris/everybodyhateschris, http://www.azlyrics.com/lyrics/ludacris/everybodyhateschris.html
What Them Girls Like, Theater Of The Mind, ludacris/whatthemgirlslike, http://www.azlyrics.com/lyrics/ludacris/whatthemgirlslike.html
I Do It For Hip Hop, Theater Of The Mind, ludacris/idoitforhiphop, http://www.azlyrics.com/lyrics/ludacris/idoitforhiphop.html
Intro, Battle Of The Sexes, ludacris/intro102228, http://www.azlyrics.com/lyrics/ludacris/intro102228.html
Hey Ho, Battle Of The Sexes, ludacris/heyho, http://www.azlyrics.com/lyrics/ludacris/heyho.html
B.O.T.S. Radio, Battle Of The Sexes, ludacris/botsradio, http://www.azlyrics.com/lyrics/ludacris/botsradio.html
Can't Live With You, Battle Of The Sexes, ludacris/cantlivewithyou, http://www.azlyrics.com/lyrics/ludacris/cantlivewithyou.html
How Low (Remix), Battle Of The Sexes, ludacris/howlowremix, http://www.azlyrics.com/lyrics/ludacris/howlowremix.html
Muthafucka Can U Buy That, 1.21 Gigawatts: Back To The First Time, ludacris/muthafuckacanubuythat, http://www.azlyrics.com/lyrics/ludacris/muthafuckacanubuythat.html
Say It To My Face, 1.21 Gigawatts: Back To The First Time, ludacris/sayittomyface, http://www.azlyrics.com/lyrics/ludacris/sayittomyface.html
Shake N Fries, 1.21 Gigawatts: Back To The First Time, ludacris/shakenfries, http://www.azlyrics.com/lyrics/ludacris/shakenfries.html
What You Smoking On, 1.21 Gigawatts: Back To The First Time, ludacris/whatyousmokingon, http://www.azlyrics.com/lyrics/ludacris/whatyousmokingon.html
Raised In The South, #IDGAF, ludacris/raisedinthesouth, http://www.azlyrics.com/lyrics/ludacris/raisedinthesouth.html
Hell Of A Night, #IDGAF, ludacris/hellofanight, http://www.azlyrics.com/lyrics/ludacris/hellofanight.html
Speak Into The Mic, #IDGAF, ludacris/speakintothemic, http://www.azlyrics.com/lyrics/ludacris/speakintothemic.html
New Beginning Intro, Burning Bridges, ludacris/newbeginningintro, http://www.azlyrics.com/lyrics/ludacris/newbeginningintro.html
Money, Burning Bridges, ludacris/money, http://www.azlyrics.com/lyrics/ludacris/money.html
Problems, Burning Bridges, ludacris/problems, http://www.azlyrics.com/lyrics/ludacris/problems.html
In My Life, Burning Bridges, ludacris/inmylife, http://www.azlyrics.com/lyrics/ludacris/inmylife.html
Ludaversal (Intro), Ludaversal, ludacris/ludaversalintro, http://www.azlyrics.com/lyrics/ludacris/ludaversalintro.html
Get Lit, Ludaversal, ludacris/getlit, http://www.azlyrics.com/lyrics/ludacris/getlit.html
Not Long, Ludaversal, ludacris/notlong, http://www.azlyrics.com/lyrics/ludacris/notlong.html
Money, Ludaversal, ludacris/money, http://www.azlyrics.com/lyrics/ludacris/money.html
Problems, Ludaversal, ludacris/problems, http://www.azlyrics.com/lyrics/ludacris/problems.html
In My Life, Ludaversal, ludacris/inmylife, http://www.azlyrics.com/lyrics/ludacris/inmylife.html
Act A Fool, Misc: Ludacris, ludacris/actafool, http://www.azlyrics.com/lyrics/ludacris/actafool.html
Can You Buy That, Misc: Ludacris, ludacris/canyoubuythat, http://www.azlyrics.com/lyrics/ludacris/canyoubuythat.html
Furiously Dangerous, Misc: Ludacris, ludacris/furiouslydangerous, http://www.azlyrics.com/lyrics/ludacris/furiouslydangerous.html
Georgia, Misc: Ludacris, ludacris/georgia, http://www.azlyrics.com/lyrics/ludacris/georgia.html
Gold Digger, Misc: Ludacris, ludacris/golddigger, http://www.azlyrics.com/lyrics/ludacris/golddigger.html
It Wasn't Us, Misc: Ludacris, ludacris/itwasntus, http://www.azlyrics.com/lyrics/ludacris/itwasntus.html
Rest Of My Life, Misc: Ludacris, ludacris/restofmylife, http://www.azlyrics.com/lyrics/ludacris/restofmylife.html
Rhymes Like Dimes, Operation: Doomsday, mfdoom/rhymeslikedimes, http://www.azlyrics.com/lyrics/mfdoom/rhymeslikedimes.html
The Finest, Operation: Doomsday, mfdoom/thefinest, http://www.azlyrics.com/lyrics/mfdoom/thefinest.html
Back In The Days (Skit), Operation: Doomsday, mfdoom/backinthedaysskit, http://www.azlyrics.com/lyrics/mfdoom/backinthedaysskit.html
Go With The Flow, Operation: Doomsday, mfdoom/gowiththeflow, http://www.azlyrics.com/lyrics/mfdoom/gowiththeflow.html
Tick. Tick..., Operation: Doomsday, mfdoom/ticktick, http://www.azlyrics.com/lyrics/mfdoom/ticktick.html
Red & Gold, Operation: Doomsday, mfdoom/redgold, http://www.azlyrics.com/lyrics/mfdoom/redgold.html
The Mic, Operation: Doomsday, mfdoom/themic, http://www.azlyrics.com/lyrics/mfdoom/themic.html
Dead Bent, Operation: Doomsday, mfdoom/deadbent, http://www.azlyrics.com/lyrics/mfdoom/deadbent.html
Gas Drawls, Operation: Doomsday, mfdoom/gasdrawls, http://www.azlyrics.com/lyrics/mfdoom/gasdrawls.html
Hero Vs. Villain (Epilogue), Operation: Doomsday, mfdoom/herovsvillainepilogue, http://www.azlyrics.com/lyrics/mfdoom/herovsvillainepilogue.html
Krazy World, Take Me To Your Leader, mfdoom/krazyworld, http://www.azlyrics.com/lyrics/mfdoom/krazyworld.html
Next Levels, Take Me To Your Leader, mfdoom/nextlevels, http://www.azlyrics.com/lyrics/mfdoom/nextlevels.html
I Wonder, Take Me To Your Leader, mfdoom/iwonder, http://www.azlyrics.com/lyrics/mfdoom/iwonder.html
One Smart Nigger, Take Me To Your Leader, mfdoom/onesmartnigger, http://www.azlyrics.com/lyrics/mfdoom/onesmartnigger.html
The Drop, Vaudeville Villain, mfdoom/thedrop, http://www.azlyrics.com/lyrics/mfdoom/thedrop.html
Lactose And Lecithin, Vaudeville Villain, mfdoom/lactoseandlecithin, http://www.azlyrics.com/lyrics/mfdoom/lactoseandlecithin.html
Never Dead, Vaudeville Villain, mfdoom/neverdead, http://www.azlyrics.com/lyrics/mfdoom/neverdead.html
Mr. Clean, Vaudeville Villain, mfdoom/mrclean, http://www.azlyrics.com/lyrics/mfdoom/mrclean.html
The Illest Villains, Madvillainy, mfdoom/theillestvillains, http://www.azlyrics.com/lyrics/mfdoom/theillestvillains.html
Meat Grinder, Madvillainy, mfdoom/meatgrinder, http://www.azlyrics.com/lyrics/mfdoom/meatgrinder.html
Bistro, Madvillainy, mfdoom/bistro, http://www.azlyrics.com/lyrics/mfdoom/bistro.html
Raid, Madvillainy, mfdoom/raid, http://www.azlyrics.com/lyrics/mfdoom/raid.html
Hardcore Hustle, Madvillainy, mfdoom/hardcorehustle, http://www.azlyrics.com/lyrics/mfdoom/hardcorehustle.html
Fancy Clown, Madvillainy, mfdoom/fancyclown, http://www.azlyrics.com/lyrics/mfdoom/fancyclown.html
Eye, Madvillainy, mfdoom/eye, http://www.azlyrics.com/lyrics/mfdoom/eye.html
All Caps, Madvillainy, mfdoom/allcaps, http://www.azlyrics.com/lyrics/mfdoom/allcaps.html
Rhinestone Cowboy, Madvillainy, mfdoom/rhinestonecowboy, http://www.azlyrics.com/lyrics/mfdoom/rhinestonecowboy.html
Back End, Venomous Villain, mfdoom/backend, http://www.azlyrics.com/lyrics/mfdoom/backend.html
R.A.P. G.A.M.E., Venomous Villain, mfdoom/rapgame, http://www.azlyrics.com/lyrics/mfdoom/rapgame.html
Doper Skiller, Venomous Villain, mfdoom/doperskiller, http://www.azlyrics.com/lyrics/mfdoom/doperskiller.html
Ode To Road Rage, Venomous Villain, mfdoom/odetoroadrage, http://www.azlyrics.com/lyrics/mfdoom/odetoroadrage.html
Pop Quiz (Bonus Extra Credit Remix), Venomous Villain, mfdoom/popquizbonusextracreditremix, http://www.azlyrics.com/lyrics/mfdoom/popquizbonusextracreditremix.html
Hoe Cakes, Mm.. Food?, mfdoom/hoecakes, http://www.azlyrics.com/lyrics/mfdoom/hoecakes.html
One Beer, Mm.. Food?, mfdoom/onebeer, http://www.azlyrics.com/lyrics/mfdoom/onebeer.html
Deep Fried Frenz, Mm.. Food?, mfdoom/deepfriedfrenz, http://www.azlyrics.com/lyrics/mfdoom/deepfriedfrenz.html
Poo-Putt Platter, Mm.. Food?, mfdoom/pooputtplatter, http://www.azlyrics.com/lyrics/mfdoom/pooputtplatter.html
Kon Queso, Mm.. Food?, mfdoom/konqueso, http://www.azlyrics.com/lyrics/mfdoom/konqueso.html
Sofa King, The Mouse And The Mask, mfdoom/sofaking, http://www.azlyrics.com/lyrics/mfdoom/sofaking.html
The Mask, The Mouse And The Mask, mfdoom/themask, http://www.azlyrics.com/lyrics/mfdoom/themask.html
Perfect Hair, The Mouse And The Mask, mfdoom/perfecthair, http://www.azlyrics.com/lyrics/mfdoom/perfecthair.html
Benzie Box, The Mouse And The Mask, mfdoom/benziebox, http://www.azlyrics.com/lyrics/mfdoom/benziebox.html
No Names, The Mouse And The Mask, mfdoom/nonames, http://www.azlyrics.com/lyrics/mfdoom/nonames.html
Space Ho's, The Mouse And The Mask, mfdoom/spacehos, http://www.azlyrics.com/lyrics/mfdoom/spacehos.html
Supervillain Intro, Born Like This, mfdoom/supervillainintro, http://www.azlyrics.com/lyrics/mfdoom/supervillainintro.html
Gazzillion Ear, Born Like This, mfdoom/gazzillionear, http://www.azlyrics.com/lyrics/mfdoom/gazzillionear.html
Ballskin, Born Like This, mfdoom/ballskin, http://www.azlyrics.com/lyrics/mfdoom/ballskin.html
Yessir!, Born Like This, mfdoom/yessir, http://www.azlyrics.com/lyrics/mfdoom/yessir.html
Batty Boyz, Born Like This, mfdoom/battyboyz, http://www.azlyrics.com/lyrics/mfdoom/battyboyz.html
Cellz, Born Like This, mfdoom/cellz, http://www.azlyrics.com/lyrics/mfdoom/cellz.html
More Rhymin', Born Like This, mfdoom/morerhymin, http://www.azlyrics.com/lyrics/mfdoom/morerhymin.html
Supervillainz, Born Like This, mfdoom/supervillainz, http://www.azlyrics.com/lyrics/mfdoom/supervillainz.html
Dawg Friendly, Key To The Kuffs, mfdoom/dawgfriendly, http://www.azlyrics.com/lyrics/mfdoom/dawgfriendly.html
Bout The Shoes, Key To The Kuffs, mfdoom/bouttheshoes, http://www.azlyrics.com/lyrics/mfdoom/bouttheshoes.html
Still Kaps, Key To The Kuffs, mfdoom/stillkaps, http://www.azlyrics.com/lyrics/mfdoom/stillkaps.html
Intro, Nehruviandoom, mfdoom/intro, http://www.azlyrics.com/lyrics/mfdoom/intro.html
Caskets, Nehruviandoom, mfdoom/caskets, http://www.azlyrics.com/lyrics/mfdoom/caskets.html
Disastrous, Nehruviandoom, mfdoom/disastrous, http://www.azlyrics.com/lyrics/mfdoom/disastrous.html
Hot Guacamole, Misc: MF Doom, mfdoom/hotguacamole, http://www.azlyrics.com/lyrics/mfdoom/hotguacamole.html
Impostas, Misc: MF Doom, mfdoom/impostas, http://www.azlyrics.com/lyrics/mfdoom/impostas.html
Super Hero, Misc: MF Doom, mfdoom/superhero, http://www.azlyrics.com/lyrics/mfdoom/superhero.html
The Genesis, Illmatic, nas/thegenesis, http://www.azlyrics.com/lyrics/nas/thegenesis.html
N.Y. State Of Mind, Illmatic, nas/nystateofmind, http://www.azlyrics.com/lyrics/nas/nystateofmind.html
Life's A Bitch, Illmatic, nas/lifesabitch, http://www.azlyrics.com/lyrics/nas/lifesabitch.html
Album Intro, It Was Written, nas/albumintro, http://www.azlyrics.com/lyrics/nas/albumintro.html
The Message, It Was Written, nas/themessage, http://www.azlyrics.com/lyrics/nas/themessage.html
Take It In Blood, It Was Written, nas/takeitinblood, http://www.azlyrics.com/lyrics/nas/takeitinblood.html
Black Girl Lost, It Was Written, nas/blackgirllost, http://www.azlyrics.com/lyrics/nas/blackgirllost.html
Suspect, It Was Written, nas/suspect, http://www.azlyrics.com/lyrics/nas/suspect.html
Shootouts, It Was Written, nas/shootouts, http://www.azlyrics.com/lyrics/nas/shootouts.html
Live Nigga Rap, It Was Written, nas/liveniggarap, http://www.azlyrics.com/lyrics/nas/liveniggarap.html
Favor For A Favor, I Am, nas/favorforafavor, http://www.azlyrics.com/lyrics/nas/favorforafavor.html
Dr. Knockboot, I Am, nas/drknockboot, http://www.azlyrics.com/lyrics/nas/drknockboot.html
Big Things, I Am, nas/bigthings, http://www.azlyrics.com/lyrics/nas/bigthings.html
Nas Is Like, I Am, nas/nasislike, http://www.azlyrics.com/lyrics/nas/nasislike.html
K-I-SS-I-N-G, I Am, nas/kissing, http://www.azlyrics.com/lyrics/nas/kissing.html
The Prediction, Nastradamus, nas/theprediction, http://www.azlyrics.com/lyrics/nas/theprediction.html
Nastradamus, Nastradamus, nas/nastradamus, http://www.azlyrics.com/lyrics/nas/nastradamus.html
Come Get Me, Nastradamus, nas/comegetme, http://www.azlyrics.com/lyrics/nas/comegetme.html
Last Words, Nastradamus, nas/lastwords, http://www.azlyrics.com/lyrics/nas/lastwords.html
God Love Us, Nastradamus, nas/godloveus, http://www.azlyrics.com/lyrics/nas/godloveus.html
Quiet Niggas, Nastradamus, nas/quietniggas, http://www.azlyrics.com/lyrics/nas/quietniggas.html
Big Girl, Nastradamus, nas/biggirl, http://www.azlyrics.com/lyrics/nas/biggirl.html
The Outcome, Nastradamus, nas/theoutcome, http://www.azlyrics.com/lyrics/nas/theoutcome.html
Smokin', Stillmatic, nas/smokin, http://www.azlyrics.com/lyrics/nas/smokin.html
Rewind, Stillmatic, nas/rewind, http://www.azlyrics.com/lyrics/nas/rewind.html
2nd Childhood, Stillmatic, nas/2ndchildhood, http://www.azlyrics.com/lyrics/nas/2ndchildhood.html
Rule, Stillmatic, nas/rule, http://www.azlyrics.com/lyrics/nas/rule.html
What Goes Around, Stillmatic, nas/whatgoesaround, http://www.azlyrics.com/lyrics/nas/whatgoesaround.html
Doo Rags, The Lost Tapes, nas/doorags, http://www.azlyrics.com/lyrics/nas/doorags.html
Nothing Lasts Forever, The Lost Tapes, nas/nothinglastsforever, http://www.azlyrics.com/lyrics/nas/nothinglastsforever.html
No Idea's Original, The Lost Tapes, nas/noideasoriginal, http://www.azlyrics.com/lyrics/nas/noideasoriginal.html
Blaze A 50, The Lost Tapes, nas/blazea50, http://www.azlyrics.com/lyrics/nas/blazea50.html
Purple, The Lost Tapes, nas/purple, http://www.azlyrics.com/lyrics/nas/purple.html
Black Zombie, The Lost Tapes, nas/blackzombie, http://www.azlyrics.com/lyrics/nas/blackzombie.html
The Cross, God's Son, nas/thecross, http://www.azlyrics.com/lyrics/nas/thecross.html
Last Real Nigga Alive, God's Son, nas/lastrealniggaalive, http://www.azlyrics.com/lyrics/nas/lastrealniggaalive.html
Zone Out, God's Son, nas/zoneout, http://www.azlyrics.com/lyrics/nas/zoneout.html
Hey Nas, God's Son, nas/heynas, http://www.azlyrics.com/lyrics/nas/heynas.html
Dance, God's Son, nas/dance, http://www.azlyrics.com/lyrics/nas/dance.html
A Message To The Feds. Sincerely. We The People, Street's Disciple, nas/amessagetothefedssincerelywethepeople, http://www.azlyrics.com/lyrics/nas/amessagetothefedssincerelywethepeople.html
Sekou Story, Street's Disciple, nas/sekoustory, http://www.azlyrics.com/lyrics/nas/sekoustory.html
Reason, Street's Disciple, nas/reason, http://www.azlyrics.com/lyrics/nas/reason.html
Street's Disciple, Street's Disciple, nas/streetsdisciple, http://www.azlyrics.com/lyrics/nas/streetsdisciple.html
War, Street's Disciple, nas/war, http://www.azlyrics.com/lyrics/nas/war.html
Money Over Bullshit, Hip Hop Is Dead, nas/moneyoverbullshit, http://www.azlyrics.com/lyrics/nas/moneyoverbullshit.html
You Can't Kill Me, Hip Hop Is Dead, nas/youcantkillme, http://www.azlyrics.com/lyrics/nas/youcantkillme.html
Hip Hop Is Dead, Hip Hop Is Dead, nas/hiphopisdead, http://www.azlyrics.com/lyrics/nas/hiphopisdead.html
Black Republican, Hip Hop Is Dead, nas/blackrepublican, http://www.azlyrics.com/lyrics/nas/blackrepublican.html
Hold Down The Block, Hip Hop Is Dead, nas/holddowntheblock, http://www.azlyrics.com/lyrics/nas/holddowntheblock.html
Let There Be Light, Hip Hop Is Dead, nas/lettherebelight, http://www.azlyrics.com/lyrics/nas/lettherebelight.html
Play On Playa, Hip Hop Is Dead, nas/playonplaya, http://www.azlyrics.com/lyrics/nas/playonplaya.html
Hustlers, Hip Hop Is Dead, nas/hustlers, http://www.azlyrics.com/lyrics/nas/hustlers.html
Hope, Hip Hop Is Dead, nas/hope, http://www.azlyrics.com/lyrics/nas/hope.html
Where Y'all At?, Hip Hop Is Dead, nas/whereyallat, http://www.azlyrics.com/lyrics/nas/whereyallat.html
Sly Fox, Untitled, nas/slyfox, http://www.azlyrics.com/lyrics/nas/slyfox.html
Testify, Untitled, nas/testify, http://www.azlyrics.com/lyrics/nas/testify.html
Fried Chicken, Untitled, nas/friedchicken, http://www.azlyrics.com/lyrics/nas/friedchicken.html
We're Not Alone, Untitled, nas/werenotalone, http://www.azlyrics.com/lyrics/nas/werenotalone.html
Like Me, Untitled, nas/likeme, http://www.azlyrics.com/lyrics/nas/likeme.html
Strong Will Continue, Distant Relatives, nas/strongwillcontinue, http://www.azlyrics.com/lyrics/nas/strongwillcontinue.html
Leaders, Distant Relatives, nas/leaders, http://www.azlyrics.com/lyrics/nas/leaders.html
Friends, Distant Relatives, nas/friends, http://www.azlyrics.com/lyrics/nas/friends.html
Dispear, Distant Relatives, nas/dispear, http://www.azlyrics.com/lyrics/nas/dispear.html
In His Own Words, Distant Relatives, nas/inhisownwords, http://www.azlyrics.com/lyrics/nas/inhisownwords.html
Patience, Distant Relatives, nas/patience, http://www.azlyrics.com/lyrics/nas/patience.html
No Introduction, Life Is Good, nas/nointroduction, http://www.azlyrics.com/lyrics/nas/nointroduction.html
Loco-Motive, Life Is Good, nas/locomotive, http://www.azlyrics.com/lyrics/nas/locomotive.html
Reach Out, Life Is Good, nas/reachout, http://www.azlyrics.com/lyrics/nas/reachout.html
World's An Addiction, Life Is Good, nas/worldsanaddiction, http://www.azlyrics.com/lyrics/nas/worldsanaddiction.html
Summer On Smash, Life Is Good, nas/summeronsmash, http://www.azlyrics.com/lyrics/nas/summeronsmash.html
Back When, Life Is Good, nas/backwhen, http://www.azlyrics.com/lyrics/nas/backwhen.html
Bye Baby, Life Is Good, nas/byebaby, http://www.azlyrics.com/lyrics/nas/byebaby.html
Nasty, Life Is Good, nas/nasty, http://www.azlyrics.com/lyrics/nas/nasty.html
The Black Bond, Life Is Good, nas/theblackbond, http://www.azlyrics.com/lyrics/nas/theblackbond.html
