Corner Bodega, Power Of The Dollar, 50cent/cornerbodega, http://www.azlyrics.com/lyrics/50cent/cornerbodega.html
Life's On The Line, Power Of The Dollar, 50cent/lifesontheline, http://www.azlyrics.com/lyrics/50cent/lifesontheline.html
That Ain't Gangsta, Power Of The Dollar, 50cent/thataintgangsta, http://www.azlyrics.com/lyrics/50cent/thataintgangsta.html
Ghetto Quran (Forgive Me Pt. 1), Power Of The Dollar, 50cent/ghettoquranforgivemept1, http://www.azlyrics.com/lyrics/50cent/ghettoquranforgivemept1.html
Gun Runners, Power Of The Dollar, 50cent/gunrunners, http://www.azlyrics.com/lyrics/50cent/gunrunners.html
Power Of The Dollar, Power Of The Dollar, 50cent/powerofthedollar, http://www.azlyrics.com/lyrics/50cent/powerofthedollar.html
U Should Be Here, 50 Cent Is The Future, 50cent/ushouldbehere, http://www.azlyrics.com/lyrics/50cent/ushouldbehere.html
Whoo Kid Kayslay Shit!, 50 Cent Is The Future, 50cent/whookidkayslayshit, http://www.azlyrics.com/lyrics/50cent/whookidkayslayshit.html
Just Fuckin' Around, 50 Cent Is The Future, 50cent/justfuckinaround, http://www.azlyrics.com/lyrics/50cent/justfuckinaround.html
Tony Yayo Explosion, 50 Cent Is The Future, 50cent/tonyyayoexplosion, http://www.azlyrics.com/lyrics/50cent/tonyyayoexplosion.html
A Little Bit Of Everything U.T.P., 50 Cent Is The Future, 50cent/alittlebitofeverythingutp, http://www.azlyrics.com/lyrics/50cent/alittlebitofeverythingutp.html
I Smell Pussy, 50 Cent Is The Future, 50cent/ismellpussy, http://www.azlyrics.com/lyrics/50cent/ismellpussy.html
Killa Tape Intro, Guess Who's Back?, 50cent/killatapeintro, http://www.azlyrics.com/lyrics/50cent/killatapeintro.html
Rotten Apple, Guess Who's Back?, 50cent/rottenapple, http://www.azlyrics.com/lyrics/50cent/rottenapple.html
That's What's Up, Guess Who's Back?, 50cent/thatswhatsup, http://www.azlyrics.com/lyrics/50cent/thatswhatsup.html
U Not Like Me, Guess Who's Back?, 50cent/unotlikeme, http://www.azlyrics.com/lyrics/50cent/unotlikeme.html
Life's On The Line, Guess Who's Back?, 50cent/lifesontheline, http://www.azlyrics.com/lyrics/50cent/lifesontheline.html
Be A Gentleman, Guess Who's Back?, 50cent/beagentleman, http://www.azlyrics.com/lyrics/50cent/beagentleman.html
Fuck You, Guess Who's Back?, 50cent/fuckyou, http://www.azlyrics.com/lyrics/50cent/fuckyou.html
Who U Rep With, Guess Who's Back?, 50cent/whourepwith, http://www.azlyrics.com/lyrics/50cent/whourepwith.html
Corner Bodega, Guess Who's Back?, 50cent/cornerbodega, http://www.azlyrics.com/lyrics/50cent/cornerbodega.html
U Heard Me, Guess Who's Back?, 50cent/uheardme, http://www.azlyrics.com/lyrics/50cent/uheardme.html
Elementry, No Mercy. No Fear, 50cent/elementry, http://www.azlyrics.com/lyrics/50cent/elementry.html
Banks Victory, No Mercy. No Fear, 50cent/banksvictory, http://www.azlyrics.com/lyrics/50cent/banksvictory.html
After My Cheddar, No Mercy. No Fear, 50cent/aftermycheddar, http://www.azlyrics.com/lyrics/50cent/aftermycheddar.html
Say What You Want, No Mercy. No Fear, 50cent/saywhatyouwant, http://www.azlyrics.com/lyrics/50cent/saywhatyouwant.html
Clue Shit!, No Mercy. No Fear, 50cent/clueshit, http://www.azlyrics.com/lyrics/50cent/clueshit.html
Wanksta, No Mercy. No Fear, 50cent/wanksta, http://www.azlyrics.com/lyrics/50cent/wanksta.html
In Da Club, Get Rich Or Die Tryin', 50cent/indaclub, http://www.azlyrics.com/lyrics/50cent/indaclub.html
Blood Hound, Get Rich Or Die Tryin', 50cent/bloodhound, http://www.azlyrics.com/lyrics/50cent/bloodhound.html
Poor Lil Rich, Get Rich Or Die Tryin', 50cent/poorlilrich, http://www.azlyrics.com/lyrics/50cent/poorlilrich.html
Don't Push Me, Get Rich Or Die Tryin', 50cent/dontpushme, http://www.azlyrics.com/lyrics/50cent/dontpushme.html
U Not Like Me, Get Rich Or Die Tryin', 50cent/unotlikeme, http://www.azlyrics.com/lyrics/50cent/unotlikeme.html
Life's On The Line, Get Rich Or Die Tryin', 50cent/lifesontheline, http://www.azlyrics.com/lyrics/50cent/lifesontheline.html
Wanksta, Get Rich Or Die Tryin', 50cent/wanksta, http://www.azlyrics.com/lyrics/50cent/wanksta.html
In Da Hood, The New Breed, 50cent/indahood, http://www.azlyrics.com/lyrics/50cent/indahood.html
Intro, The Massacre, 50cent/intro45506, http://www.azlyrics.com/lyrics/50cent/intro45506.html
In My Hood, The Massacre, 50cent/inmyhood, http://www.azlyrics.com/lyrics/50cent/inmyhood.html
This Is 50, The Massacre, 50cent/thisis50, http://www.azlyrics.com/lyrics/50cent/thisis50.html
Gatman And Robbin, The Massacre, 50cent/gatmanandrobbin, http://www.azlyrics.com/lyrics/50cent/gatmanandrobbin.html
Outta Control, The Massacre, 50cent/outtacontrol, http://www.azlyrics.com/lyrics/50cent/outtacontrol.html
Ski Mask Way, The Massacre, 50cent/skimaskway, http://www.azlyrics.com/lyrics/50cent/skimaskway.html
A Baltimore Love Thing, The Massacre, 50cent/abaltimorelovething, http://www.azlyrics.com/lyrics/50cent/abaltimorelovething.html
My Toy Soldier, The Massacre, 50cent/mytoysoldier, http://www.azlyrics.com/lyrics/50cent/mytoysoldier.html
Build You Up, The Massacre, 50cent/buildyouup, http://www.azlyrics.com/lyrics/50cent/buildyouup.html
So Amazing, The Massacre, 50cent/soamazing, http://www.azlyrics.com/lyrics/50cent/soamazing.html
Hustlers Ambition, Get Rich Or Die Tryin', 50cent/hustlersambition, http://www.azlyrics.com/lyrics/50cent/hustlersambition.html
We Both Think Alike, Get Rich Or Die Tryin', 50cent/weboththinkalike, http://www.azlyrics.com/lyrics/50cent/weboththinkalike.html
I Don't Know Officer, Get Rich Or Die Tryin', 50cent/idontknowofficer, http://www.azlyrics.com/lyrics/50cent/idontknowofficer.html
Best Friend, Get Rich Or Die Tryin', 50cent/bestfriend, http://www.azlyrics.com/lyrics/50cent/bestfriend.html
Intro, Curtis, 50cent/intro65397, http://www.azlyrics.com/lyrics/50cent/intro65397.html
My Gun Go Off, Curtis, 50cent/mygungooff, http://www.azlyrics.com/lyrics/50cent/mygungooff.html
Straight To The Bank, Curtis, 50cent/straighttothebank, http://www.azlyrics.com/lyrics/50cent/straighttothebank.html
Peep Show, Curtis, 50cent/peepshow, http://www.azlyrics.com/lyrics/50cent/peepshow.html
Fire, Curtis, 50cent/fire, http://www.azlyrics.com/lyrics/50cent/fire.html
All Of Me, Curtis, 50cent/allofme, http://www.azlyrics.com/lyrics/50cent/allofme.html
Curtis 187, Curtis, 50cent/curtis187, http://www.azlyrics.com/lyrics/50cent/curtis187.html
Touch The Sky, Curtis, 50cent/touchthesky, http://www.azlyrics.com/lyrics/50cent/touchthesky.html
I'll Do Anything, War Angel LP, 50cent/illdoanything, http://www.azlyrics.com/lyrics/50cent/illdoanything.html
London Girl, War Angel LP, 50cent/londongirl, http://www.azlyrics.com/lyrics/50cent/londongirl.html
Cocaine, War Angel LP, 50cent/cocaine, http://www.azlyrics.com/lyrics/50cent/cocaine.html
I Gotta Win, War Angel LP, 50cent/igottawin, http://www.azlyrics.com/lyrics/50cent/igottawin.html
Funny How Time Flies, Forever King, 50cent/funnyhowtimeflies, http://www.azlyrics.com/lyrics/50cent/funnyhowtimeflies.html
Dreaming, Forever King, 50cent/dreaming, http://www.azlyrics.com/lyrics/50cent/dreaming.html
Michael Jackson Freestyle, Forever King, 50cent/michaeljacksonfreestyle, http://www.azlyrics.com/lyrics/50cent/michaeljacksonfreestyle.html
Hold Me Down, Before I Self Destruct, 50cent/holdmedown, http://www.azlyrics.com/lyrics/50cent/holdmedown.html
Stretch, Before I Self Destruct, 50cent/stretch, http://www.azlyrics.com/lyrics/50cent/stretch.html
Get It Hot, Before I Self Destruct, 50cent/getithot, http://www.azlyrics.com/lyrics/50cent/getithot.html
I Got Swag, Before I Self Destruct, 50cent/igotswag, http://www.azlyrics.com/lyrics/50cent/igotswag.html
Baby By Me, Before I Self Destruct, 50cent/babybyme85808, http://www.azlyrics.com/lyrics/50cent/babybyme85808.html
Could've Been You, Before I Self Destruct, 50cent/couldvebeenyou, http://www.azlyrics.com/lyrics/50cent/couldvebeenyou.html
Man's World, Before I Self Destruct, 50cent/mansworld, http://www.azlyrics.com/lyrics/50cent/mansworld.html
Niggas Be' Schemin', The Big 10, 50cent/niggasbeschemin, http://www.azlyrics.com/lyrics/50cent/niggasbeschemin.html
Queens. NY, The Big 10, 50cent/queensny, http://www.azlyrics.com/lyrics/50cent/queensny.html
Put Ya' Hands Up, The Big 10, 50cent/putyahandsup, http://www.azlyrics.com/lyrics/50cent/putyahandsup.html
Wait Until Tonight, The Big 10, 50cent/waituntiltonight, http://www.azlyrics.com/lyrics/50cent/waituntiltonight.html
Stop Crying, The Big 10, 50cent/stopcrying, http://www.azlyrics.com/lyrics/50cent/stopcrying.html
Outro Skit, The Big 10, 50cent/outroskit, http://www.azlyrics.com/lyrics/50cent/outroskit.html
Get Busy, The Lost Tape, 50cent/getbusy, http://www.azlyrics.com/lyrics/50cent/getbusy.html
Murder One, The Lost Tape, 50cent/murderone, http://www.azlyrics.com/lyrics/50cent/murderone.html
Riot (Remix), The Lost Tape, 50cent/riotremix, http://www.azlyrics.com/lyrics/50cent/riotremix.html
I Ain't Gonna Lie, The Lost Tape, 50cent/iaintgonnalie, http://www.azlyrics.com/lyrics/50cent/iaintgonnalie.html
You A Killer..Cool, The Lost Tape, 50cent/youakillercool, http://www.azlyrics.com/lyrics/50cent/youakillercool.html
Planet 50, The Lost Tape, 50cent/planet50, http://www.azlyrics.com/lyrics/50cent/planet50.html
Lay Down (Smoked), The Lost Tape, 50cent/laydownsmoked, http://www.azlyrics.com/lyrics/50cent/laydownsmoked.html
All His Love, The Lost Tape, 50cent/allhislove, http://www.azlyrics.com/lyrics/50cent/allhislove.html
United Nations, 5 (Murder By Numbers), 50cent/unitednations, http://www.azlyrics.com/lyrics/50cent/unitednations.html
Business Mind, 5 (Murder By Numbers), 50cent/businessmind, http://www.azlyrics.com/lyrics/50cent/businessmind.html
Definition Of Sexy, 5 (Murder By Numbers), 50cent/definitionofsexy, http://www.azlyrics.com/lyrics/50cent/definitionofsexy.html
Animal Ambition, Animal Ambition, 50cent/animalambition, http://www.azlyrics.com/lyrics/50cent/animalambition.html
Pilot, Animal Ambition, 50cent/pilot, http://www.azlyrics.com/lyrics/50cent/pilot.html
Irregular Heartbeat, Animal Ambition, 50cent/irregularheartbeat, http://www.azlyrics.com/lyrics/50cent/irregularheartbeat.html
Hustler, Animal Ambition, 50cent/hustler, http://www.azlyrics.com/lyrics/50cent/hustler.html
Chase The Paper, Animal Ambition, 50cent/chasethepaper, http://www.azlyrics.com/lyrics/50cent/chasethepaper.html
The Funeral, Animal Ambition, 50cent/thefuneral, http://www.azlyrics.com/lyrics/50cent/thefuneral.html
Nigga Nigga, The Kanan Tape, 50cent/nigganigga, http://www.azlyrics.com/lyrics/50cent/nigganigga.html
Too Rich For The Bitch, The Kanan Tape, 50cent/toorichforthebitch, http://www.azlyrics.com/lyrics/50cent/toorichforthebitch.html
Body Bags, The Kanan Tape, 50cent/bodybags, http://www.azlyrics.com/lyrics/50cent/bodybags.html
Burner On Me, The Kanan Tape, 50cent/burneronme, http://www.azlyrics.com/lyrics/50cent/burneronme.html
Major Distribution, Street King Immortal, 50cent/majordistribution, http://www.azlyrics.com/lyrics/50cent/majordistribution.html
New Day, Street King Immortal, 50cent/newday, http://www.azlyrics.com/lyrics/50cent/newday.html
21 Questions (Remix), Misc: 50 Cent, 50cent/21questionsremix, http://www.azlyrics.com/lyrics/50cent/21questionsremix.html
Bullshit & Party, Misc: 50 Cent, 50cent/bullshitparty, http://www.azlyrics.com/lyrics/50cent/bullshitparty.html
Drama Never Ends, Misc: 50 Cent, 50cent/dramaneverends, http://www.azlyrics.com/lyrics/50cent/dramaneverends.html
Fuck Dat Bitch, Misc: 50 Cent, 50cent/fuckdatbitch, http://www.azlyrics.com/lyrics/50cent/fuckdatbitch.html
Get Up, Misc: 50 Cent, 50cent/getup, http://www.azlyrics.com/lyrics/50cent/getup.html
Girls Go Wild, Misc: 50 Cent, 50cent/girlsgowild, http://www.azlyrics.com/lyrics/50cent/girlsgowild.html
I'm All Turnt Up (Freestyle), Misc: 50 Cent, 50cent/imallturntupfreestyle, http://www.azlyrics.com/lyrics/50cent/imallturntupfreestyle.html
I'm An Animal, Misc: 50 Cent, 50cent/imananimal, http://www.azlyrics.com/lyrics/50cent/imananimal.html
Non Stop (Street King Energy Track #4), Misc: 50 Cent, 50cent/nonstopstreetkingenergytrack4, http://www.azlyrics.com/lyrics/50cent/nonstopstreetkingenergytrack4.html
Old 2003 Ferrari, Misc: 50 Cent, 50cent/old2003ferrari, http://www.azlyrics.com/lyrics/50cent/old2003ferrari.html
Outlaw, Misc: 50 Cent, 50cent/outlaw, http://www.azlyrics.com/lyrics/50cent/outlaw.html
Rowdy Rowdy, Misc: 50 Cent, 50cent/rowdyrowdy, http://www.azlyrics.com/lyrics/50cent/rowdyrowdy.html
See Me Bleeding, Misc: 50 Cent, 50cent/seemebleeding, http://www.azlyrics.com/lyrics/50cent/seemebleeding.html
Shady Murder (Street King Energy Track #9), Misc: 50 Cent, 50cent/shadymurderstreetkingenergytrack9, http://www.azlyrics.com/lyrics/50cent/shadymurderstreetkingenergytrack9.html
Southside, Misc: 50 Cent, 50cent/southside, http://www.azlyrics.com/lyrics/50cent/southside.html
Street King Energy Track #7 (You Lose), Misc: 50 Cent, 50cent/streetkingenergytrack7youlose, http://www.azlyrics.com/lyrics/50cent/streetkingenergytrack7youlose.html
The Paper (I Get It) (Freestyle), Misc: 50 Cent, 50cent/thepaperigetitfreestyle, http://www.azlyrics.com/lyrics/50cent/thepaperigetitfreestyle.html
They Burn Me, Misc: 50 Cent, 50cent/theyburnme, http://www.azlyrics.com/lyrics/50cent/theyburnme.html
Through The Window, Misc: 50 Cent, 50cent/throughthewindow, http://www.azlyrics.com/lyrics/50cent/throughthewindow.html
Tia Told Me (Rick Ross Diss), Misc: 50 Cent, 50cent/tiatoldmerickrossdiss, http://www.azlyrics.com/lyrics/50cent/tiatoldmerickrossdiss.html
Wanksta (Remix), Misc: 50 Cent, 50cent/wankstaremix, http://www.azlyrics.com/lyrics/50cent/wankstaremix.html
Warning You, Misc: 50 Cent, 50cent/warningyou, http://www.azlyrics.com/lyrics/50cent/warningyou.html
What Up Gangsta Part 2, Misc: 50 Cent, 50cent/whatupgangstapart2, http://www.azlyrics.com/lyrics/50cent/whatupgangstapart2.html
Uptown, Deep Purple, asaprocky/uptown, http://www.azlyrics.com/lyrics/asaprocky/uptown.html
Peso, Live.Love.A$ap, asaprocky/peso, http://www.azlyrics.com/lyrics/asaprocky/peso.html
Wassup, Live.Love.A$ap, asaprocky/wassup, http://www.azlyrics.com/lyrics/asaprocky/wassup.html
Purple Swag Chapter 2, Live.Love.A$ap, asaprocky/purpleswagchapter2, http://www.azlyrics.com/lyrics/asaprocky/purpleswagchapter2.html
Keep It G, Live.Love.A$ap, asaprocky/keepitg, http://www.azlyrics.com/lyrics/asaprocky/keepitg.html
Houston Old Head, Live.Love.A$ap, asaprocky/houstonoldhead, http://www.azlyrics.com/lyrics/asaprocky/houstonoldhead.html
Acid Drip, Live.Love.A$ap, asaprocky/aciddrip, http://www.azlyrics.com/lyrics/asaprocky/aciddrip.html
Leaf, Live.Love.A$ap, asaprocky/leaf, http://www.azlyrics.com/lyrics/asaprocky/leaf.html
Roll One Up, Live.Love.A$ap, asaprocky/rolloneup, http://www.azlyrics.com/lyrics/asaprocky/rolloneup.html
PMW (All I Really Need), Long.Live.A$ap, asaprocky/pmwallireallyneed, http://www.azlyrics.com/lyrics/asaprocky/pmwallireallyneed.html
Wild For The Night, Long.Live.A$ap, asaprocky/wildforthenight, http://www.azlyrics.com/lyrics/asaprocky/wildforthenight.html
Fashion Killa, Long.Live.A$ap, asaprocky/fashionkilla, http://www.azlyrics.com/lyrics/asaprocky/fashionkilla.html
Phoenix, Long.Live.A$ap, asaprocky/phoenix, http://www.azlyrics.com/lyrics/asaprocky/phoenix.html
Ghetto Symphony, Long.Live.A$ap, asaprocky/ghettosymphony, http://www.azlyrics.com/lyrics/asaprocky/ghettosymphony.html
Angels, Long.Live.A$ap, asaprocky/angels, http://www.azlyrics.com/lyrics/asaprocky/angels.html
Pretty Flacko (Remix), Long.Live.A$ap, asaprocky/prettyflackoremix, http://www.azlyrics.com/lyrics/asaprocky/prettyflackoremix.html
Holy Ghost, At.Long.Last.A$AP, asaprocky/holyghost, http://www.azlyrics.com/lyrics/asaprocky/holyghost.html
Lord Pretty Flacko Jodye 2, At.Long.Last.A$AP, asaprocky/lordprettyflackojodye2, http://www.azlyrics.com/lyrics/asaprocky/lordprettyflackojodye2.html
Electric Body, At.Long.Last.A$AP, asaprocky/electricbody, http://www.azlyrics.com/lyrics/asaprocky/electricbody.html
Jukebox Joints, At.Long.Last.A$AP, asaprocky/jukeboxjoints, http://www.azlyrics.com/lyrics/asaprocky/jukeboxjoints.html
Pharsyde, At.Long.Last.A$AP, asaprocky/pharsyde, http://www.azlyrics.com/lyrics/asaprocky/pharsyde.html
Better Things, At.Long.Last.A$AP, asaprocky/betterthings, http://www.azlyrics.com/lyrics/asaprocky/betterthings.html
Dreams (Interlude), At.Long.Last.A$AP, asaprocky/dreamsinterlude, http://www.azlyrics.com/lyrics/asaprocky/dreamsinterlude.html
Everyday, At.Long.Last.A$AP, asaprocky/everyday, http://www.azlyrics.com/lyrics/asaprocky/everyday.html
Goldie Mack, Misc: Asap Rocky, asaprocky/goldiemack, http://www.azlyrics.com/lyrics/asaprocky/goldiemack.html
Multiply, Misc: Asap Rocky, asaprocky/multiply, http://www.azlyrics.com/lyrics/asaprocky/multiply.html
Thuggin Noise, Misc: Asap Rocky, asaprocky/thugginnoise, http://www.azlyrics.com/lyrics/asaprocky/thugginnoise.html
89.9FM Nighttrain Promo, Music For Earthworms, aesoprock/899fmnighttrainpromo, http://www.azlyrics.com/lyrics/aesoprock/899fmnighttrainpromo.html
Coordinates, Music For Earthworms, aesoprock/coordinates, http://www.azlyrics.com/lyrics/aesoprock/coordinates.html
Plastic Soldiers, Music For Earthworms, aesoprock/plasticsoldiers, http://www.azlyrics.com/lyrics/aesoprock/plasticsoldiers.html
Blue In The Face, Appleseed, aesoprock/blueintheface, http://www.azlyrics.com/lyrics/aesoprock/blueintheface.html
Fascination, Float, aesoprock/fascination, http://www.azlyrics.com/lyrics/aesoprock/fascination.html
Oxygen, Float, aesoprock/oxygen, http://www.azlyrics.com/lyrics/aesoprock/oxygen.html
Skip Town, Float, aesoprock/skiptown, http://www.azlyrics.com/lyrics/aesoprock/skiptown.html
Spare A Match, Float, aesoprock/spareamatch, http://www.azlyrics.com/lyrics/aesoprock/spareamatch.html
How To Be A Carpenter, Float, aesoprock/howtobeacarpenter, http://www.azlyrics.com/lyrics/aesoprock/howtobeacarpenter.html
The Mayor And The Crook, Float, aesoprock/themayorandthecrook, http://www.azlyrics.com/lyrics/aesoprock/themayorandthecrook.html
Flashflood, Labor Days, aesoprock/flashflood, http://www.azlyrics.com/lyrics/aesoprock/flashflood.html
No Regrets, Labor Days, aesoprock/noregrets, http://www.azlyrics.com/lyrics/aesoprock/noregrets.html
One Brick, Labor Days, aesoprock/onebrick, http://www.azlyrics.com/lyrics/aesoprock/onebrick.html
The Tugboat Complex Pt. 3, Labor Days, aesoprock/thetugboatcomplexpt3, http://www.azlyrics.com/lyrics/aesoprock/thetugboatcomplexpt3.html
Battery, Labor Days, aesoprock/battery, http://www.azlyrics.com/lyrics/aesoprock/battery.html
Bent Life, Labor Days, aesoprock/bentlife, http://www.azlyrics.com/lyrics/aesoprock/bentlife.html
The Yes And The Y'all, Labor Days, aesoprock/theyesandtheyall, http://www.azlyrics.com/lyrics/aesoprock/theyesandtheyall.html
Shovel, Labor Days, aesoprock/shovel, http://www.azlyrics.com/lyrics/aesoprock/shovel.html
N.Y. Electric, Bazooka Tooth, aesoprock/nyelectric, http://www.azlyrics.com/lyrics/aesoprock/nyelectric.html
Easy, Bazooka Tooth, aesoprock/easy, http://www.azlyrics.com/lyrics/aesoprock/easy.html
Frijoles, Bazooka Tooth, aesoprock/frijoles, http://www.azlyrics.com/lyrics/aesoprock/frijoles.html
11:35, Bazooka Tooth, aesoprock/1135, http://www.azlyrics.com/lyrics/aesoprock/1135.html
Number Nine, Fast Cars. Danger. Fire And Knives, aesoprock/numbernine, http://www.azlyrics.com/lyrics/aesoprock/numbernine.html
Holy Smokes, Fast Cars. Danger. Fire And Knives, aesoprock/holysmokes, http://www.azlyrics.com/lyrics/aesoprock/holysmokes.html
Winners Take All, Fast Cars. Danger. Fire And Knives, aesoprock/winnerstakeall, http://www.azlyrics.com/lyrics/aesoprock/winnerstakeall.html
Food. Clothes. Medicine, Fast Cars. Danger. Fire And Knives, aesoprock/foodclothesmedicine, http://www.azlyrics.com/lyrics/aesoprock/foodclothesmedicine.html
The Harbor Is Yours, None Shall Pass, aesoprock/theharborisyours, http://www.azlyrics.com/lyrics/aesoprock/theharborisyours.html
Gun For The Whole Family, None Shall Pass, aesoprock/gunforthewholefamily, http://www.azlyrics.com/lyrics/aesoprock/gunforthewholefamily.html
Five Fingers, None Shall Pass, aesoprock/fivefingers, http://www.azlyrics.com/lyrics/aesoprock/fivefingers.html
No City, None Shall Pass, aesoprock/nocity, http://www.azlyrics.com/lyrics/aesoprock/nocity.html
Pigs, None Shall Pass, aesoprock/pigs, http://www.azlyrics.com/lyrics/aesoprock/pigs.html
Leisureforce, Skelethon, aesoprock/leisureforce, http://www.azlyrics.com/lyrics/aesoprock/leisureforce.html
Ruby '81, Skelethon, aesoprock/ruby81, http://www.azlyrics.com/lyrics/aesoprock/ruby81.html
1.000 O'Clock, Skelethon, aesoprock/1000oclock, http://www.azlyrics.com/lyrics/aesoprock/1000oclock.html
Saturn Missiles, Skelethon, aesoprock/saturnmissiles, http://www.azlyrics.com/lyrics/aesoprock/saturnmissiles.html
Gopher Guts, Skelethon, aesoprock/gopherguts, http://www.azlyrics.com/lyrics/aesoprock/gopherguts.html
Rings, The Impossible Kid, aesoprock/rings, http://www.azlyrics.com/lyrics/aesoprock/rings.html
Lotta Years, The Impossible Kid, aesoprock/lottayears, http://www.azlyrics.com/lyrics/aesoprock/lottayears.html
Supercell, The Impossible Kid, aesoprock/supercell, http://www.azlyrics.com/lyrics/aesoprock/supercell.html
Blood Sandwich, The Impossible Kid, aesoprock/bloodsandwich, http://www.azlyrics.com/lyrics/aesoprock/bloodsandwich.html
Get Out Of The Car, The Impossible Kid, aesoprock/getoutofthecar, http://www.azlyrics.com/lyrics/aesoprock/getoutofthecar.html
Shrunk, The Impossible Kid, aesoprock/shrunk, http://www.azlyrics.com/lyrics/aesoprock/shrunk.html
Kirby, The Impossible Kid, aesoprock/kirby, http://www.azlyrics.com/lyrics/aesoprock/kirby.html
Tuff, The Impossible Kid, aesoprock/tuff, http://www.azlyrics.com/lyrics/aesoprock/tuff.html
Molecules, The Impossible Kid, aesoprock/molecules, http://www.azlyrics.com/lyrics/aesoprock/molecules.html
Syrup, The Impossible Kid, aesoprock/syrup, http://www.azlyrics.com/lyrics/aesoprock/syrup.html
1 Of 4 (Thank You), Misc: Aesop Rock, aesoprock/1of4thankyou, http://www.azlyrics.com/lyrics/aesoprock/1of4thankyou.html
Untouchable (AR Version), Misc: Aesop Rock, aesoprock/untouchablearversion, http://www.azlyrics.com/lyrics/aesoprock/untouchablearversion.html
Flawless (Remix), Beyoncé, beyonceknowles/flawlessremix, http://www.azlyrics.com/lyrics/beyonceknowles/flawlessremix.html
Desire. Want. Need, Finally Famous Vol. 2: UKNOWBIGSEAN, bigsean/desirewantneed, http://www.azlyrics.com/lyrics/bigsean/desirewantneed.html
Final Hour, Finally Famous Vol. 3: BIG, bigsean/finalhour, http://www.azlyrics.com/lyrics/bigsean/finalhour.html
Meant To Be, Finally Famous Vol. 3: BIG, bigsean/meanttobe, http://www.azlyrics.com/lyrics/bigsean/meanttobe.html
Five Bucks (5 On It), Finally Famous Vol. 3: BIG, bigsean/fivebucks5onit, http://www.azlyrics.com/lyrics/bigsean/fivebucks5onit.html
Crazy, Finally Famous Vol. 3: BIG, bigsean/crazy, http://www.azlyrics.com/lyrics/bigsean/crazy.html
Made, Finally Famous Vol. 3: BIG, bigsean/made, http://www.azlyrics.com/lyrics/bigsean/made.html
Love Song, Finally Famous Vol. 3: BIG, bigsean/lovesong, http://www.azlyrics.com/lyrics/bigsean/lovesong.html
Memories, Finally Famous Vol. 3: BIG, bigsean/memories, http://www.azlyrics.com/lyrics/bigsean/memories.html
Glenwood, Finally Famous Vol. 3: BIG, bigsean/glenwood, http://www.azlyrics.com/lyrics/bigsean/glenwood.html
Wait For Me, Finally Famous: The Album, bigsean/waitforme, http://www.azlyrics.com/lyrics/bigsean/waitforme.html
Marvin & Chardonnay, Finally Famous: The Album, bigsean/marvinchardonnay, http://www.azlyrics.com/lyrics/bigsean/marvinchardonnay.html
Dance (A$$), Finally Famous: The Album, bigsean/dancea, http://www.azlyrics.com/lyrics/bigsean/dancea.html
High, Finally Famous: The Album, bigsean/high, http://www.azlyrics.com/lyrics/bigsean/high.html
So Much More, Finally Famous: The Album, bigsean/somuchmore, http://www.azlyrics.com/lyrics/bigsean/somuchmore.html
How It Feel, Detroit, bigsean/howitfeel, http://www.azlyrics.com/lyrics/bigsean/howitfeel.html
Woke Up, Detroit, bigsean/wokeup, http://www.azlyrics.com/lyrics/bigsean/wokeup.html
Experimental, Detroit, bigsean/experimental, http://www.azlyrics.com/lyrics/bigsean/experimental.html
Sellin' Dreams, Detroit, bigsean/sellindreams, http://www.azlyrics.com/lyrics/bigsean/sellindreams.html
I'm Gonna Be, Detroit, bigsean/imgonnabe, http://www.azlyrics.com/lyrics/bigsean/imgonnabe.html
Do What I Gotta Do, Detroit, bigsean/dowhatigottado, http://www.azlyrics.com/lyrics/bigsean/dowhatigottado.html
RWT, Detroit, bigsean/rwt, http://www.azlyrics.com/lyrics/bigsean/rwt.html
Once Bitten. Twice Shy, Detroit, bigsean/oncebittentwiceshy, http://www.azlyrics.com/lyrics/bigsean/oncebittentwiceshy.html
Nothing Is Stopping You, Hall Of Fame, bigsean/nothingisstoppingyou, http://www.azlyrics.com/lyrics/bigsean/nothingisstoppingyou.html
10 2 10, Hall Of Fame, bigsean/10210, http://www.azlyrics.com/lyrics/bigsean/10210.html
You Don't Know, Hall Of Fame, bigsean/youdontknow, http://www.azlyrics.com/lyrics/bigsean/youdontknow.html
Mona Lisa, Hall Of Fame, bigsean/monalisa, http://www.azlyrics.com/lyrics/bigsean/monalisa.html
Freaky, Hall Of Fame, bigsean/freaky, http://www.azlyrics.com/lyrics/bigsean/freaky.html
MILF, Hall Of Fame, bigsean/milf, http://www.azlyrics.com/lyrics/bigsean/milf.html
Sierra Leone / Greedy Ho's, Hall Of Fame, bigsean/sierraleonegreedyhos, http://www.azlyrics.com/lyrics/bigsean/sierraleonegreedyhos.html
World Ablaze, Hall Of Fame, bigsean/worldablaze, http://www.azlyrics.com/lyrics/bigsean/worldablaze.html
All Figured Out, Hall Of Fame, bigsean/allfiguredout, http://www.azlyrics.com/lyrics/bigsean/allfiguredout.html
Blessings, Dark Sky Paradise, bigsean/blessings, http://www.azlyrics.com/lyrics/bigsean/blessings.html
All Your Fault, Dark Sky Paradise, bigsean/allyourfault, http://www.azlyrics.com/lyrics/bigsean/allyourfault.html
I Don't Fuck With You, Dark Sky Paradise, bigsean/idontfuckwithyou, http://www.azlyrics.com/lyrics/bigsean/idontfuckwithyou.html
